Headline,URL
"Leicester's Europa League win over Legia Warsaw is marred by ugly scenes in the stands as away fans attack police, attempt to break through segregation and throw missiles",https://www.dailymail.co.uk/sport/football/article-10244135/Legia-Warsaw-fans-attack-police-clash-Leicester-Europa-League.html
Biden's Thanksgiving menu revealed: First Family enjoys traditional turkey dinner with stuffing and fixings after watching Macy's parade in their $30M Nantucket retreat,https://www.dailymail.co.uk/news/article-10244773/Bidens-Thanksgiving-menu-revealed-celebrate-Nantucket.html
Afghan 'girl with the green eyes' from iconic 1985 National Geographic cover is given safe haven in Italy after fleeing the Taliban,https://www.dailymail.co.uk/news/article-10243227/Afghan-girl-famous-cover-portrait-evacuated-Italy.html
Is that a royal pantomime parade? Oh yes it is! Windsor Castle unveils costumes worn by the Queen and Princess Margaret as teenagers on display for the first time,https://www.dailymail.co.uk/femail/article-10242381/Costumes-worn-Queen-teenager-pantomimes-unveiled-Windsor-Castle.html
Go WILD in the garden! Our critic selects her pick of this year's best books for nature lovers,https://www.dailymail.co.uk/home/books/article-10243749/Go-WILD-garden-critic-selects-pick-years-best-books-nature-lovers.html
"Have yourself a Mary little Xmas: And garnish with some Rick Stein, Gordon Ramsay, James Martin and Ottolenghi... Constance Craig Smith selects the year's best cookery books",https://www.dailymail.co.uk/home/books/article-10243743/Constance-Craig-Smith-selects-years-best-cookery-books.html
Are NFTs on your HOME the future of mortgages? Bacon Coin wants to fund properties by offering stakes in it to crypto investors,https://www.dailymail.co.uk/money/crypto/article-10234977/Are-NFTs-future-mortgages-Bacon-Coin-wants-fund-homes.html
"Reads to warm a winter evening: From the Booker winner to heart-stopping page-turners, cold-blooded crime and raunchy romps, our reviewers choose the best books to fill your family's stockings",https://www.dailymail.co.uk/home/books/article-10243751/Our-reviewers-choose-best-books-familys-stockings.html
"Hundreds of breasted figurines, decorative plates and other artifacts given as offerings to the ancient Egyptian goddess of love and fertility are uncovered in 3,500-year-old TRASH PILE in Luxor",https://www.dailymail.co.uk/sciencetech/article-10238733/Hundreds-offerings-ancient-Egyptian-goddess-3-500-year-old-trash-pile.html
"On sale for just £50,000: The fire ravaged three-bed house in Oxford that could be yours for a song - but it needs a complete rebuild and you view it at your 'own risk' ",https://www.dailymail.co.uk/news/article-10243489/On-sale-just-50-000-fire-ravaged-three-bed-house-Oxford.html
'Size matters': PM is accused of breaking ANOTHER promise as ministers unveil plans for 'leaner' hi-tech army declaring troops WILL still be based in Germany and creating a 'Union Division' in rebuke to Sturgeon's separatist push     ,https://www.dailymail.co.uk/news/article-10243063/Ministers-unveil-plans-leaner-hi-tech-army-declaring-Union-Division.html
Alright for some! Commons Leader Jacob Rees-Mogg announces the Christmas holidays for MPs will be EXTENDED by an extra day,https://www.dailymail.co.uk/news/article-10243241/Christmas-holidays-MPs-EXTENDED-extra-day.html
Campaigners fail in bid to secure 'McMafia' order that would make Donald Trump explain where he got $60m in cash to buy Turnberry golf course,https://www.dailymail.co.uk/news/article-10243723/Campaigners-fail-order-make-Donald-Trump-say-got-60m-Turnberry-golf-course.html
"Maradona was buried 'without his HEART to stop fans from stealing it', journalist claims ",https://www.dailymail.co.uk/news/article-10243383/Maradona-buried-without-HEART-stop-fans-stealing-journalist-claims.html
Watchdog probes 'misconduct' at Naomi Campbell's charity over concerns about its finances ,https://www.dailymail.co.uk/tvshowbiz/article-10244161/Watchdog-probes-misconduct-Naomi-Campbells-charity-concerns-finances.html
Army 'mobilised for new Cold War': British troops return to Germany amid fears of Russia threat to Europe's border ,https://www.dailymail.co.uk/news/article-10244069/British-troops-return-Germany-amid-fears-Russia-threat-Europes-border.html
"Princess Charlene 'almost died' after sinus surgery and has 'lost nearly half her body weight' due to being 'unable to swallow', sources tell Page Six - and say it's 'unfair' to portray her as struggling with mental health issues ",https://www.dailymail.co.uk/femail/article-10242211/Princess-Charlene-died-following-surgery-mystery-illness.html
Six rescue workers DIE trying to reach trapped Russian miners as death toll rises to 52: Rescue bid is halted as deadly gas builds up underground following initial blast that 'wiped 11 victims off face of the earth' ,https://www.dailymail.co.uk/news/article-10243629/Three-rescue-workers-DIE-trying-reach-35-trapped-Russian-miners-following-major-explosion.html
"A pound of pears and a baby boy, please! Mother, 31, uses M&S scales to weigh her son... because drop-in clinics are shut due to Covid ",https://www.dailymail.co.uk/news/article-10244547/Mother-31-uses-M-S-scales-weigh-son-drop-clinics-shut-Covid.html
'It's time for Cressida Dick to GO': Mother of murdered sisters whose bodies were photographed by police officers calls for Met Commissioner to resign as she reveals she only apologised when she was TOLD to,https://www.dailymail.co.uk/news/article-10242269/Mother-murdered-sisters-bodies-photographed-cops-calls-Met-Commissioner-go.html
Liverpool cabbie realised suicide attacker was carrying a bomb when he saw red light on vest his passenger was wearing,https://www.dailymail.co.uk/news/article-10243673/Liverpool-cabbie-realised-suicide-attacker-carrying-bomb-saw-red-light-vest.html
The world's largest migrant camp: More than a MILLION Rohingya refugees live in makeshift homes spread across five square miles in Bangladesh after fleeing oppression in Myanmar,https://www.dailymail.co.uk/news/article-10242373/More-MILLION-Rohingya-refugees-live-camp-spread-five-square-miles-Bangladesh.html
"'Our stores will be fully stocked this Christmas,' says Majestic Wine boss in rebuke to fears of a stock shortage affecting the alcohol industry",https://www.dailymail.co.uk/money/markets/article-10242815/Our-stores-fully-stocked-Christmas-says-Majestic-Wine-boss.html
"Government launches appeal against High Court ruling that it broke the law by awarding £560,000 contract to firm whose bosses were friends of Dominic Cummings ",https://www.dailymail.co.uk/news/article-10243677/Government-launches-appeal-against-ruling-broke-law-allocation-contracts.html
"Inside J.R.R Tolkien's secret world: Photographs of The Lord of The Rings author at home with his hand-drawn map of Middle Earth and his personal letters are set to go under the hammer for £25,000 ",https://www.dailymail.co.uk/news/article-10242465/Inside-Tolkiens-world-Photographs-Lord-Rings-author-home-hammer.html
"Stunning Knightsbridge apartment that was once home to one of Princess Diana's bridesmaids goes on the market for £5.25m - and offers potential investors a rental income of £1,000 a night ",https://www.dailymail.co.uk/news/article-10242489/Apartment-home-Princess-Dianas-big-sister-bridesmaid-goes-market-5-25m.html
"Father, 48, who weighs 22 stone tells how he collapsed in the street three times after he was 'spiked by injection' during night out celebrating friend's birthday ",https://www.dailymail.co.uk/news/article-10243627/Father-48-weighs-22-stone-says-collapsed-street-three-times-spiked.html
Could YOU give this rejected rescue dog a home? Adorable crossbreed with larger-than-life personality is still waiting for a loving family after no one has shown interest for four months,https://www.dailymail.co.uk/femail/article-10242527/Rescue-dog-no-viewings-142-days-shelter-sadly-reveals.html
PAUL THOMAS on... a Channel tit-for-tat,https://www.dailymail.co.uk/news/article-10244645/PAUL-THOMAS-Channel-tit-tat.html
Hiker's best friend! Mountain climbers return to Mexico's highest peak to rescue stray dog who followed them on expedition but then stayed there for a MONTH in freezing weather,https://www.dailymail.co.uk/news/article-10243841/Hikers-best-friend-Mountain-climbers-return-Mexicos-highest-peak-rescue-stray-dog.html
"Extinctions of the world's largest animals including woolly mammoths, giant bison and ancient horses triggered dramatic increases in grassland FIRES, study finds ",https://www.dailymail.co.uk/sciencetech/article-10243399/Earth-science-Extinctions-worlds-largest-animals-triggered-increased-grassland-FIRES.html
Postman sacked by Royal Mail after falling over twice at work because he wasn't looking where he was going loses unfair dismissal claim ,https://www.dailymail.co.uk/news/article-10243611/Postman-sacked-Royal-Mail-falling-twice-work-loses-unfair-dismissal-claim.html
