Headline,URL
"£1m taxpayers' bill to bring our rubbish back from Poland: Environment Agency is paying private company to return 1,500 tonnes of waste illegally dumped by UK firms",https://www.dailymail.co.uk/news/article-10424551/The-1m-taxpayers-bill-bring-rubbish-Poland.html
Tycoon and Tory adviser are accused of 'bullying' former MP Charlotte Leslie in row over Middle East group,https://www.dailymail.co.uk/news/article-10425351/Tycoon-Tory-adviser-accused-bullying-former-MP-Charlotte-Leslie.html
"Babies can tell who has close relationships based on their exchange of SALIVA through kissing or sharing food, study claims ",https://www.dailymail.co.uk/sciencetech/article-10423439/Babies-know-relationships-close-two-people-share-SALIVA-study-says.html
Would you pay for an Instagram? Meta-owned social media platform tests subscription service that lets creators charge a fee to access exclusive content,https://www.dailymail.co.uk/sciencetech/article-10424475/Instagram-tests-subscription-service-lets-creators-charge-fee-access-exclusive-content.html
"Man, 59, spent four nights sleeping on CHAIR in Cardiff A&E after arriving with fast-spreading skin condition ",https://www.dailymail.co.uk/news/article-10423839/Man-59-spent-four-nights-sleeping-CHAIR-Cardiff-E-fast-spreading-skin-condition.html
Strictly arena tour in last-minute chaos as Tilly Ramsay's partner Nikita Kuzmin drops out hours before first live show after testing positive for Covid ,https://www.dailymail.co.uk/tvshowbiz/article-10426307/Strictly-arena-tour-chaos-Tilly-Ramsays-pro-partner-Nikita-Kuzmin-drops-out.html
How to commit the perfect murder: A new book on poison is a detailed primer on getting rid of your enemies - if only you could work out a way not to get caught...,https://www.dailymail.co.uk/home/books/article-10424227/A-new-book-poison-detailed-primer-getting-rid-enemies.html
Third of councils in Scotland boycott controversial survey which asks schoolchildren 'intrusive' questions about underage sex - but SNP still refuses to withdraw it ,https://www.dailymail.co.uk/news/article-10423487/Third-councils-Scotland-boycott-survey-asking-children-sex.html
"Underpaid state pension scandal is a 'shameful shambles,' and the DWP is not trying hard enough to help wronged pensioners, claim MPs",https://www.dailymail.co.uk/money/pensions/article-10423641/State-pension-scandal-shameful-shambles-say-MPs.html
Claws out at cats charity: Chief executive quits after his chairman keeps her job... despite having '18 moggies' in her home ,https://www.dailymail.co.uk/news/article-10425037/Chief-executive-quits-chairman-keeps-job-despite-having-18-moggies-home.html
"Nobel Prize awarded to Jewish physicist who fled Austria as a teenager after Nazi invasion then studied at Harvard is put up for sale by his family for £20,000",https://www.dailymail.co.uk/news/article-10422707/Nobel-Prize-awarded-Jewish-physicist-Walter-Kohn-sale-family-20-000.html
Reese Witherspoon becomes the first Oscar-winning actress to sign up for Cbeebies Bedtime Stories,https://www.dailymail.co.uk/tvshowbiz/article-10424165/Reese-Witherspoon-Oscar-winner-sign-Cbeebies-Bedtime-Stories.html
Happy 18th birthday Princess Ingrid Alexandra! Heir to Norway's throne celebrates milestone day as she attends cabinet meeting in the Royal Palace with her grandfather ,https://www.dailymail.co.uk/femail/article-10426735/Happy-18th-birthday-Princess-Ingrid-Alexandra-Heir-throne-celebrates-milestone-day.html
"Talk about a deep dive! Albatrosses can plunge up to 62ft underwater to pursue prey-more than twice as deep as previously thought, study reveals",https://www.dailymail.co.uk/sciencetech/article-10423777/Nature-Albatrosses-plunge-62ft-underwater-prey-twice-deep-thought.html
UPenn swimmer accuses trans teammate Lia Thomas of conspiring WITH trans Yale swimmer to lose against her,https://www.dailymail.co.uk/news/article-10424371/UPenn-swimmer-accuses-trans-teammate-Lia-Thomas-plot-LOSE-against-transgender-Yale-swimmer.html
"'I won't be in this week or, actually, ever again': What factory worker, 61, told his boss when he scooped £2million prize on a scratch card after he almost didn't buy one because of ROADWORKS outside the shop",https://www.dailymail.co.uk/news/article-10423397/Factory-worker-scoops-2million-prize-scratch-card.html
Cotswolds Tory chief is forced out by 'bullies' as she pushes for probe into 'venal behaviour' ,https://www.dailymail.co.uk/news/article-10425295/Cotswolds-Tory-chief-forced-bullies-pushes-probe-venal-behaviour.html
A treehouse fit for a prince! Charles embraces his inner child as he opens a nature-based adventure park at his Scottish stately home Dumfries House,https://www.dailymail.co.uk/femail/article-10424053/Prince-Charles-opens-nature-based-childrens-adventure-playground-Dumfries-House-estate.html
"How whales gulp down food underwater without drowning: Animals have an 'oral plug' in their mouths that helps seal off their airways during feeding to stop water entering the lungs, study finds",https://www.dailymail.co.uk/sciencetech/article-10422823/Nature-Biologists-determine-whales-gulp-food-underwater-without-drowning.html
Sleep in a Star Wars Galactic Starcruiser in Orlando and a lodge in Bali with no doors: The best new hotel arrivals around the world in 2022,https://www.dailymail.co.uk/travel/escape/article-10405541/The-best-new-hotel-arrivals-world-2022-New-York-Bali-Cote-Dazur.html
Is this the ULTIMATE hangover cure? New York dietician reveals recipe for four-ingredient 'recovery lemonade' that she claims will heal ANY post-alcohol agony,https://www.dailymail.co.uk/femail/article-10423205/ULTIMATE-hangover-cure-Dietician-reveals-recipe-drink-claims-heal-post-alcohol-agony.html
"Fraudsters use fake endorsements from Harry and Meghan to promote scam bitcoin investment adverts including one claiming they made £128,000 every month ",https://www.dailymail.co.uk/news/article-10422789/Fraudsters-use-fake-endorsements-Harry-Meghan-promote-scam-bitcoin-investment-adverts.html
"Mother, 31, appears in court charged with murdering her two-month-old son found with 'head injuries' as the baby's father is accused of causing or allowing the tot's death",https://www.dailymail.co.uk/news/article-10422561/Mother-appears-court-charged-murder-two-month-old-son-Essex.html
"Iceland delivery driver who 'was hired as a £100,000 hitman to murder an activist criticising the Pakistani government, referred to targets as 'fish' and told police he bought a knife to cut bread and fruit', court hears ",https://www.dailymail.co.uk/news/article-10423411/Iceland-delivery-driver-hired-hitman-kill-Pakistani-activist-hiding-Rotterdam-court-hears.html
"British pilot, 19, becomes youngest woman to fly solo round the world and the first to do so in a microlight plane after five-month, 32,000-mile journey over 52 nations ",https://www.dailymail.co.uk/news/article-10423247/British-pilot-youngest-woman-fly-solo-world-sight-only.html
Vegan woman whose boyfriend didn't realize she'd been cooking him plant-based food for months reveals he won't see her again until she says sorry for her 'lies and betrayal' - but critics say he's a 'baby' with no respect ,https://www.dailymail.co.uk/femail/article-10422691/Woman-SLAMMED-boyfriend-tricking-eating-gross-vegan-food.html
EastEnders' former set is torn down as workmen strip away old buildings deemed 'not fit for purpose' after show moved to new £87m location,https://www.dailymail.co.uk/tvshowbiz/article-10423821/EastEnders-former-set-torn-workmen-strip-away-old-buildings-deemed-not-fit-purpose.html
"Scammer, 28, who used Grindr to rob and blackmail men after having sex with them and threatened to 'out' one by sending screenshots of their messages to his girlfriend is jailed for five years ",https://www.dailymail.co.uk/news/article-10424189/Scammer-28-used-Grindr-rob-blackmail-men-having-sex-jailed-five-years.html
Pioneering electric car battery plant that could power Britain's eco drive gets £100m cash injection ,https://www.dailymail.co.uk/news/article-10425223/Electric-car-battery-plant-power-Britains-eco-drive-gets-100m-cash-injection.html
High Court judge overturns ruling allowing former Tory minister Andrew Griffiths to see his child after he was found to have raped and physically abused his wife who succeeded him as an MP ,https://www.dailymail.co.uk/news/article-10424203/High-Court-judge-overturns-ruling-allowing-former-Tory-minister-Andrew-Griffiths-child.html
Duchess of Cornwall urges people not to be 'bystanders to prejudice' as she marks 75th anniversary of the publication of the Diary of Anne Frank at reception in London with Joanna Lumley,https://www.dailymail.co.uk/femail/article-10422883/Camilla-pays-tribute-victims-Holocaust-memorial-event.html
Police boss calls for closed-down stations to be reopening to repair public faith in the force ,https://www.dailymail.co.uk/news/article-10424879/Police-boss-calls-closed-stations-reopening-repair-public-faith-force.html
Jamie Spears' request to unseal Britney's medical records is denied by judge ... who cites pop star's 'right to privacy over her private medical information',https://www.dailymail.co.uk/tvshowbiz/article-10424091/Jamie-Spears-wants-Britneys-medical-records-unsealed-defends-against-spying-accusations.html
UK battery gigafactory lands £1.7bn of funding: Abrdn and warehouse group Tritax back Britishvolt project,https://www.dailymail.co.uk/money/markets/article-10424631/UK-battery-gigafactory-lands-1-7bn-funding-Abrdn-Tritax.html
MARKET REPORT: Deliveroo shares soar as food delivery firm enjoys a lockdown takeaway boost with orders up 42%,https://www.dailymail.co.uk/money/markets/article-10424613/MARKET-REPORT-Deliveroo-shares-lifted-lockdown-takeaways.html
"Laughter really is the best medicine! Chuckling with friends reduces the risk of disability by more than 30 per cent in over-65s, study claims",https://www.dailymail.co.uk/sciencetech/article-10423063/Laughing-friends-reduces-risk-disability-study-claims.html
"Is that a guitar in your pants or...? Moment man steals $8,000 Les Paul Standard by shoving it down his sweatpants",https://www.dailymail.co.uk/news/article-10423493/Moment-man-steals-8-000-Les-Paul-Standard-shoving-sweatpants.html
"M&Ms go woke! Chocolate giant will lower trade green M&M character's stilettos for sneakers and end her rivalry with brown M&M in order to reflect 'a more dynamic, progressive world' ",https://www.dailymail.co.uk/news/article-10423249/M-Ms-woke-new-versions-characters-reflect-dynamic-progressive-world.html
Bentley's off to a 'flyer': The UK's famous luxury car brand is banking on an eco-friendly future - by launching a host of new models,https://www.dailymail.co.uk/money/cars/article-10423599/Bentley-powers-eco-friendly-future-new-Flying-Spur-Hybrid.html
Primark to axe 400 store managers to cut costs as sales remain below pre-pandemic levels,https://www.dailymail.co.uk/money/markets/article-10424819/Primark-axe-400-store-managers-cut-costs-sales-remain-low.html
"Woman who had 'never picked up a paintbrush before lockdown' transforms her drab detached home into stylish pad for £8,000 complete with bright colourful walls, bold prints and a disco-themed loo",https://www.dailymail.co.uk/femail/article-10426311/Woman-40-spends-8-000-transforming-drab-detached-home-stylish-pad.html
"The secrets of ancient Japanese tombs revealed: Satellite images show keyhole-shaped burials all face towards the arc of the rising sun, the Goddess Amaterasu that emperors linked to the mythical origin of their dynasty ",https://www.dailymail.co.uk/sciencetech/article-10423937/Ancient-Japanese-tombs-face-arc-rising-sun-study-shows.html
People in glass houses! Green campaigner lectures GMB viewers on damage that conservatories are doing to the planet - while sitting in her conservatory,https://www.dailymail.co.uk/news/article-10421987/Green-campaigner-lectures-GMB-viewers-damage-conservatories-sitting-hers.html
Ex-pope Benedict expresses 'shock and shame' at church abuse after bombshell report found he failed to take action against priests in four cases of alleged sexual abuse in his diocese while Archbishop of Munich ,https://www.dailymail.co.uk/news/article-10422121/Former-pope-Benedict-spotlight-explosive-report-child-sex-abuse.html
Putin's 'pole-dancing palace': Jailed Kremlin critic Alexei Navalny's team releases new pictures they claim show a erotic performance room 'inside the Russian President's £1billion Black Sea base' ,https://www.dailymail.co.uk/news/article-10424125/New-pictures-claimed-pole-dancing-room-inside-Putins-alleged-1billion-Black-Sea-palace.html
