Headline,URL
"Indie rock band guitarist, 24, is charged with murdering 18-year-old Bobbi-Anne McLeod who vanished from bus stop on way to meet her boyfriend",https://www.dailymail.co.uk/news/article-10245293/Man-24-charged-murdering-18-year-old-Bobbi-Anne-McLeod.html
Super-mutant Botswana Covid variant is now spotted in Israel: Germany and Italy are latest to seal off South Africa as variant drives 93% spike in cases in a day - but there are NO reports of hospitalisations in epicentre Johannesburg,https://www.dailymail.co.uk/news/article-10245333/Worst-Botswana-variant-spotted-Israel-strain-spreads-four-countries-two-weeks.html
"How to check whether your CAT is a psychopath: Study suggests tormenting its prey, meowing loudly and going into 'overdrive' could all be signs your pet has personality issues",https://www.dailymail.co.uk/news/article-10244469/How-check-cat-psychopath-Tormenting-prey-meowing-loudly-signs.html
Tube 24-hour shutdown begins: Millions face travel chaos as major lines run a reduced service or come to a complete standstill and congestion goes up by 20% after drivers walk out in Night Tube rotas row ,https://www.dailymail.co.uk/news/article-10245115/Tube-24-hour-shutdown-begins-Millions-face-travel-chaos-major-lines-run-reduced-service.html
RICHARD LITTLEJOHN: Howzat? Michael Vaughan is innocent until proven guilty ,https://www.dailymail.co.uk/debate/article-10244077/RICHARD-LITTLEJOHN-Howzat-Michael-Vaughan-innocent-proven-guilty.html
Just 40% of frontline NHS staff in England had a booster Covid vaccine at start of November and fewer than three in 10 care home staff are triple-jabbed now - despite being first in queue for third doses,https://www.dailymail.co.uk/news/article-10243769/Just-40-frontline-NHS-staff-England-booster-Covid-vaccine.html
"Girl, 12, dies of 'catastrophic injuries' after being attacked just after Liverpool Christmas lights were switched on - as four schoolboys, aged 13 to 15, are arrested on suspicion of murder ",https://www.dailymail.co.uk/news/article-10245435/Girl-12-dies-catastrophic-injuries-attacked-following-row-Liverpool-city-ce.html
Sadiq Khan says Labour's planned wealth tax would hit the 'equity rich but cash poor' and cause a 'flight' of rich people out of UK,https://www.dailymail.co.uk/news/article-10244557/Sadiq-Khan-says-Labours-planned-wealth-tax-hit-equity-rich-cash-poor.html
'Ditch the wokeism': Tony Blair says Labour will not get back into power unless it 'emphatically rejects' woke ideals and pushes hard-Left factions 'to the margins',https://www.dailymail.co.uk/news/article-10244319/Labour-not-power-unless-reject-woke-ideals-says-Tony-Blair.html
Investors brace for trouble ahead: Fears of new mutant Covid variant send FTSE 100 plunging 3% - with airline and travel shares the worst hit,https://www.dailymail.co.uk/money/markets/article-10245391/Fears-new-Covid-variant-sends-FTSE-100-plunging-3.html
"How bright lights in cities cause spring to wake EARLY: Artificial lighting in urban areas alters plants' day-night cycle, causing leaves to bud prematurely, study finds",https://www.dailymail.co.uk/sciencetech/article-10245351/Bright-lights-cities-cause-spring-come-early-study-shows.html
Now eco mob target Black Friday: XR activists lock themselves to bamboo towers and scaffolding as they block 13 Amazon warehouses across the UK,https://www.dailymail.co.uk/news/article-10245197/Extinction-Rebellion-target-Black-Friday-blocking-Amazon-fulfilment-centres.html
Black Friday...but where is everyone? Quiet start on empty High Streets as 60% of Brits get set to splash an average of £280 with an expected £9.1BILLION spent this weekend - but independent retailers REFUSE to slash prices ,https://www.dailymail.co.uk/news/article-10245455/Black-Friday-Shoppers-shun-stores-opt-online-deals-experts-say-8billion-spent.html
Macron meltdown as he brands Boris 'not serious' about migrant crisis in furious rant after PM sends letter listing five key demands to end tragedies in Channel,https://www.dailymail.co.uk/news/article-10245249/France-CANCELS-meeting-Priti-Patel-wake-deaths-27-migrants.html
Le barricade begins: French fishermen waving red flares BLOCK British cargo vessel from docking in Brittany in row over fishing licences after threatening to cause chaos at the Channel Tunnel,https://www.dailymail.co.uk/news/article-10245453/French-fisherman-waving-red-flares-BLOCK-British-cargo-vessel-docking-Brittany.html
"Tantrum diplomacy of the Tinpot Napoleon: Brexit has long been driving Emmanuel Macron to ever greater heights of irrationality - and now it's costing lives, says JONATHAN MILLER  ",https://www.dailymail.co.uk/debate/article-10244173/Tantrum-diplomacy-Tinpot-Napoleon.html
'It's not good... I don't know if we're going to make it': Chilling final phone call from migrant feared drowned in Channel - as photos shows missing teenagers preparing to make deadly crossing,https://www.dailymail.co.uk/news/article-10244191/Its-not-good-dont-know-going-make-channel-crossing-left-27-migrants-dead.html
'My wife was on the boat': Iraqi woman's husband tells how migrants' inflatable disappeared from GPS as he watched and now he fears she is among the 27 dead,https://www.dailymail.co.uk/news/article-10244361/Iraqi-womans-husband-tells-migrants-inflatable-disappeared-GPS-watched.html
Revealed: Dramatic Mayday call made by French coastguard in bid to rescue 27 migrants including three children who drowned in Channel as lifeboat volunteer describes grim moment he pulled six bodies from water in scene 'like Titanic',https://www.dailymail.co.uk/news/article-10243547/Dramatic-Mayday-call-French-coastguard-bid-rescue-27-migrants-drowned-Channel.html
"'Migrants are told they have to cross... or else they will be shot': In a dismal camp in Dunkirk, families and children are still getting ready to board flimsy boats. SUE REID exposes the ruthless efficiency that drives the deadly trade",https://www.dailymail.co.uk/news/article-10244087/The-migrants-told-cross-shot-SUE-REID-exposes-trade.html
Migrant exodus from Belarus: Iraq airlifts hundreds back home and Poland claims victory after desperate people were weaponised by dictator Alexander Lukashenko in attempt to humiliate the EU ,https://www.dailymail.co.uk/news/article-10245301/Belarus-border-crisis-Hundreds-migrants-fly-Iraq.html
"UK receives 37,562 asylum claims in a year as applications reach highest level since 2004 amid record numbers of migrants making Channel crossing ",https://www.dailymail.co.uk/news/article-10242621/UK-receives-37-562-asylum-claims-year-applications-reach-highest-level-2004.html
"Is it any wonder they'll risk their lives to get here? Migrants can expect £40 a week cash, free mobiles, four-star hotels and lawyers to help their asylum applications, writes DAVID BARRETT ",https://www.dailymail.co.uk/debate/article-10244513/Migrants-expect-40-week-free-mobiles-four-star-hotels-lawyers-writes-DAVID-BARRETT.html
"Muttering under her breath, Priti Patel looked impatient to skedaddle back to the office: HENRY DEEDES on the Home Secretary's Channel tragedy statement ",https://www.dailymail.co.uk/debate/article-10244169/HENRY-DEEDES-Home-Secretarys-Channel-tragedy-statement.html
Rishi Sunak puts block on Boris Johnson's bailout: Chancellor wins battle with Prime Minister over handouts for firms hit by energy crisis ,https://www.dailymail.co.uk/news/article-10244275/Rishi-Sunak-puts-block-Boris-Johnsons-bailout-Chancellor-wins-battle-handouts-firm.html
DAN WOOTTON: Boris is right; the people smugglers are getting away with murder - but he is aiding and abetting them and will pay the price with his job ,https://www.dailymail.co.uk/debate/article-10244063/DAN-WOOTTON-Boris-aiding-abetting-migrant-murderers-pay-price-job.html
Storm Arwen batters Britain: Temperature plunges to -4.4C as 75mph gale force winds hit with warnings for rain and snow TODAY ,https://www.dailymail.co.uk/news/article-10245163/Storm-Arwen-batters-Britain-Temperature-plunges-4-4C-75mph-gale-force-winds-hit.html
"Housework can cause women to struggle more than men with day-to-day tasks in their old age, research suggests ",https://www.dailymail.co.uk/news/article-10244287/Housework-cause-women-struggle-men-old-age-research-suggests.html
A bridge too far! Boris's dream of a crossing to Northern Ireland is shattered after official review finds it would cost up to £335BILLION to build - double the annual NHS budget,https://www.dailymail.co.uk/news/article-10245291/Boriss-NI-crossing-dream-shattered-review-puts-cost-335bn.html
Department For Transport website starts showing explicit PORNOGRAPHY instead of dull traffic statistics and the ministry's business plan ,https://www.dailymail.co.uk/news/article-10243847/Department-Transport-website-starts-showing-explicit-PORNOGRAPHY-instead-traffic-statistics.html
I'm A Celebrity is thrown into chaos as show bosses fear mass exodus after THREE more stars seek medical treatment following Richard Madeley's exit,https://www.dailymail.co.uk/tvshowbiz/celebrity/article-10244363/Im-Celebrity-bosses-fear-mass-exodus-three-stars-seek-medical-treatment.html
'He's too ill to come back on the show': GMB confirm host Richard Madeley remains unwell despite assuring fans he is 'fine' after he was forced to QUIT I'm A Celeb following hospital dash,https://www.dailymail.co.uk/tvshowbiz/article-10245507/Richard-Madeley-ill-appear-GMB-Monday-forced-QUIT-Im-Celeb.html
I'm A Celeb 2021: Tensions reach boiling point in castle camp as Naughty Boy and tearful Frankie Bridge row over how to cook rice,https://www.dailymail.co.uk/tvshowbiz/article-10243959/Im-Celeb-2021-Tensions-reach-boiling-point-Naughty-Boy-Frankie-Bridge-row-rice.html
TOM UTLEY: Forget Sod's Law... Utley's Law says that every celebrity spouts the same soggy stew of wokery ,https://www.dailymail.co.uk/debate/article-10244491/TOM-UTLEYs-law-says-celebrity-spouts-soggy-stew-wokery.html
'It's terrifying but it's a COINCIDENCE': Leading cardiologist says footballers should not panic after five high-profile collapses - but insists all players need to be checked throughout their 20s and 30s,https://www.dailymail.co.uk/sport/sportsnews/article-10244297/Leading-cardiologist-says-cluster-collapses-footballers-likely-coincidence.html
Black Friday is FINALLY here! FEMAIL reveals the best bargains as shopping extravaganza officially gets underway with discounts of up to 75% on everything from tech to home and beauty,https://www.dailymail.co.uk/femail/article-10203803/Black-Friday-2021-deals-FEMAIL-reveals-best-buys-offer.html
Amazon's Black Friday sale includes TWO of these neck pillows for under £30 - and shoppers say they're so comfortable it's 'like sleeping on marshmallows',https://www.dailymail.co.uk/femail/article-10244283/Best-Black-Friday-Amazon-pillow-deals-2021-Grab-TWO-neck-pillows-30.html
This Eye of Horus mascara that shoppers say creates 'gorgeous black thick lashes' has been reduced to under £20 for Black Friday - as the brand slashes prices by 25% across the site,https://www.dailymail.co.uk/femail/article-10243145/Eye-Horus-Black-Friday-sale-including-bestselling-Bio-Mascara.html
"The very best Amazon Black Friday beauty deals to shop today - 33 of the best offers on makeup, hair and skincare from top brands including Maybelline, Elemis and Revlon",https://www.dailymail.co.uk/femail/article-10242275/best-Amazon-Black-Friday-beauty-deals-2021-shop-today.html
Amazon has slashed 53% off this popular Shark vacuum cleaner in an unmissable Black Friday deal saving you £200  - but it's for ONE DAY ONLY so you'll have to act fast!,https://www.dailymail.co.uk/femail/article-10230797/Shark-Anti-Hair-Wrap-Vacuum-HALF-PRICE-Amazon-Black-Friday-2021-sale.html
Save over £100 on a Dyson! Wowcher has dropped some HUGE deals on the most popular vacuum cleaners - or you can pick up a pretty impressive dupe for just £32.99 (saving you 81%) ,https://www.dailymail.co.uk/femail/article-10245451/Wowcher-dropped-HUGE-deals-popular-Dyson-vacuum-cleaners-Black-Friday.html
It's the Gucci treasure hunt! Designer items will be hidden in the aisles at Asda as part of Black Friday bonanza ,https://www.dailymail.co.uk/femail/article-10244381/Gucci-items-hidden-aisles-Asda-Black-Friday-bonanza.html
"Meme material girl! Fans hilariously mock Madonna's saucy fishnet Instagram snaps - as they brand singer, 63, 'Granny long legs' and ask if she was searching for a phone charger",https://www.dailymail.co.uk/news/article-10244421/Anneka-Rice-leads-way-Internet-jokers-mock-Madonnas-saucy-fishnet-Instagram-pictures.html
"Madonna, 63, SLAMS Instagram for taking down post of her exposed nipple... and compares 'sexist' policy to the 'lies' told about Native Americans on Thanksgiving ",https://www.dailymail.co.uk/tvshowbiz/article-10243937/Madonna-63-SLAMS-Instagram-taking-post-exposed-nipple-shares-AGAIN.html
"Prince Albert, the hands-on father: Monaco royal's tactile behaviour with his six-year-old twins is 'unexpected' and shows he's offering extra love and support in their mother's absence, body language expert reveals",https://www.dailymail.co.uk/femail/article-10242477/Prince-Albert-Monaco-hands-father-Charlenes-absence.html
Model David Gandy is kicked out of pub over pals' loutish antics ,https://www.dailymail.co.uk/tvshowbiz/article-10244053/EDEN-CONFIDENTIAL-Model-David-Gandy-gets-kicked-pub-pals-loutish-antics.html
The Queen 'tells family she is feeling much better and is looking forward to hosting the entire royal family at Sandringham this Christmas',https://www.dailymail.co.uk/news/article-10244057/Queen-tells-family-feeling-better-host-Christmas-Sandringham.html
"Pensioner, 66, is charged with murdering woman, 26, whose body was found bound and gagged in a lake in 1987 as well as the kidnap and rape of a 16-year-old girl ",https://www.dailymail.co.uk/news/article-10245405/Pensioner-66-charged-murdering-Lady-Lake-Shani-Warren.html
"JAN MOIR: The liberals wring their hands, but you SHOULD get life for killing a police officer ",https://www.dailymail.co.uk/debate/article-10244123/JAN-MOIR-liberals-wring-hands-life-killing-police-officer.html
The 'dark psychological trick' to reveal if your crush likes you: Psychology graduate says you should make yourself cry to see their reaction - and explains why it's a GOOD thing if they struggle to make eye contact,https://www.dailymail.co.uk/femail/article-10243217/How-make-like-life-coach-reveals.html
'No babies in the Commons': Speaker Lindsay Hoyle says he has been 'heavily lobbied' by female MPs WITH children NOT to change the rules amid row over ban handed to Stella Creasy ,https://www.dailymail.co.uk/news/article-10245631/Speaker-Lindsay-Hoyle-heavily-lobbied-MPs-children-not-lift-Commons-ban-Creasy-row.html
Police probe into new allegations of assault and misconduct at scandal-hit Deepcut Barracks has so far failed to make any arrests after almost three years,https://www.dailymail.co.uk/news/article-10245559/No-arrests-Deepcut-barracks-probe-despite-three-year-investigation.html
"Married far-right French firebrand Eric Zemmour, 63, is expecting a lovechild with his 28-year-old personal assistant ",https://www.dailymail.co.uk/news/article-10245687/Married-far-right-French-firebrand-Eric-Zemmour-expecting-lovechild-PA-28.html
"Her novel The Lovely Bones described a rape based on her own horrific sex attack. So, asks TOM LEONARD, why has the man Alice Sebold helped convict just been exonerated? ",https://www.dailymail.co.uk/tvshowbiz/article-10244179/Why-man-Alice-Sebold-helped-convict-just-exonerated-TOM-LEONARD-asks.html
Revealed: How dogged movie producer proved the WRONG man was jailed for raping Lovely Bones author Alice Sebold after questioning Netflix adaptation of her memoir Lucky which 'glossed over' the truth,https://www.dailymail.co.uk/news/article-10239771/How-Netflix-movie-Alice-Sebolds-Lucky-exposed-wrongful-rape-charge.html
Caught on CCTV: Moment 'gunman in latex mask pretended to be street cleaner to carry out reconnaissance before shooting dead Real Housewives of Cheshire star Misse Beqiri's brother' ,https://www.dailymail.co.uk/news/article-10243615/Masked-gunman-caught-CCTV-disguised-latex-mask-shooting-dead-reality-stars-brother.html
"Football coach, 66, who sexually abused four boys over 30 years and was caught with a holdall containing children's underpants is jailed for nine years ",https://www.dailymail.co.uk/news/article-10245433/Football-coach-66-sexually-abused-four-boys-jailed-nine-years.html
Kate Middleton's new 'scientific' approach to dressing: Duchess has ditched shift dresses for tonal jumpers and coats with sleek trousers to create a 'polished' uniform that simplifies dressing for a busy mother-of-three,https://www.dailymail.co.uk/femail/article-10242585/Is-Kate-Middletons-new-uniform-Duchess-pairs-tonal-jumpers-coat-dark-trousers.html
"So who DID cheat first? For years we've been told it was Charles. Now Diana's former bodyguard insists it was SHE who strayed first - with one of his police colleagues. But, asks RICHARD KAY, is it all just a tad convenient? ",https://www.dailymail.co.uk/news/article-10244107/Princess-Dianas-former-bodyguard-insists-cheated-one-colleagues.html
'I didn't want to burden my family with what I had seen': Prince William recalls the 'pressure and stress' he felt as an Air Ambulance pilot as he launches mental health service for emergency responders,https://www.dailymail.co.uk/femail/article-10241915/Prince-William-opens-fatherhood-new-Youtube-video.html
The Crown's Elizabeth Debicki sports Princess Diana's signature locks as she continues filming alongside Mohamed Al Fayed actor Salim Daw at one of the late royal's favourite London restaurants Launceston Place,https://www.dailymail.co.uk/femail/article-10243243/The-Crowns-Elizabeth-Debicki-sports-Princess-Dianas-signature-locks-continues-filming.html
Revealed: How royal family used obscure legal procedure to keep the wills of distant relatives including Prince Philip's Danish second cousin secret over past century,https://www.dailymail.co.uk/news/article-10241993/How-royal-family-used-obscure-legal-procedure-wills-distant-relatives-sealed.html
That escalated quickly! Hilarious snaps reveal situations that rapidly got out of control - including passive aggressive fridge labelling and a beer can thrown at the TV,https://www.dailymail.co.uk/femail/article-10243153/Snaps-situations-escalated-quicker-expected.html
Woman who thought she couldn't have children after her periods stopped during a 20-year battle with anorexia that saw her weight drop to just over 4st welcomes twins at FIFTY thanks to a sperm donor and IVF,https://www.dailymail.co.uk/femail/article-10209921/Anorexic-woman-weight-dropped-5-STONE-welcomes-twin-girls-age-50.html
'It's called living in a big city': Seth Rogen faces backlash for 'privileged' response to crime in Los Angeles,https://www.dailymail.co.uk/news/article-10244697/Seth-Rogen-slammed-privileged-response-shrugging-Los-Angeles-crime.html
"Britain's energy crisis deepens as Orbit and Entice become latest suppliers to go bust hitting 70,000 households as number of failed firms hits 25 ",https://www.dailymail.co.uk/news/article-10245141/Britains-energy-crisis-deepens-Orbit-Entice-latest-suppliers-bust.html
UK car production slumps to lowest October output since 1956 as chip shortage continues to cripple motor manufacturing,https://www.dailymail.co.uk/money/cars/article-10244379/UK-car-production-slumps-lowest-October-output-1956.html
"Would YOU apply? Tech firm will pay a brave volunteer £150,000 to use their face on its ROBOTS which will work in hotels, shopping malls and airports by 2023 ",https://www.dailymail.co.uk/sciencetech/article-10245493/Robots-Tech-firm-pay-150-000-use-face-ROBOTS.html
One miner is 'pulled alive' from 'death trap' Russian mine where 52 died - as safety inspectors are arrested following explosion and methane leak,https://www.dailymail.co.uk/news/article-10245393/One-miner-pulled-alive-death-trap-Russian-52-died.html
Hugh Hefner's youngest son Cooper and British Harry Potter actress Scarlett Byrne reveal they are expecting TWINS,https://www.dailymail.co.uk/tvshowbiz/article-10244067/Hugh-Hefners-youngest-son-Cooper-Hefner-expecting-TWINS-Harry-Potter-actress-Scarlett-Byrne.html
"Best used family cars as rated by parents revealed: Audi's A3 claims top spot but spiralling second hand values means one costs £3,250 more than a year ago",https://www.dailymail.co.uk/money/cars/article-10242665/Best-used-family-cars-2021-Audi-A3-tops-list-average-budget.html
"Plant-based meat substitutes including sausages and meatballs are often packed with salt, research shows",https://www.dailymail.co.uk/news/article-10244561/Plant-based-meat-substitutes-including-sausages-meatballs-packed-salt-research-shows.html
"Ancient bling! 41,500-year-old decorated ivory pendant made from MAMMOTH bone is discovered in a cave in Poland and may be the earliest known example of ornate jewellery in Eurasia, study claims",https://www.dailymail.co.uk/sciencetech/article-10238873/Ivory-pendant-mammoth-bone-earliest-known-example-ornate-jewellery-Eurasia.html
"'It was scary giving up my job to turn my side hustle into a business, but I haven't looked back!': Entrepreneur reveals how she made her hobby pay",https://www.dailymail.co.uk/news/article-10161501/Entrepreneur-reveals-turned-hustle-business.html
Baffled Size 12 shopper who bought a Nasty Gal maxi dress to wear to be a 'sexy fortune teller' at a fancy dress party ends up with outfit 'fit for Hagrid' with neckline skimming her stomach and sleeves drooping over her hands,https://www.dailymail.co.uk/femail/article-10245489/Baffled-Size-12-shopper-ends-dress-fit-Hagrid-Nasty-Gal-shopping-fail.html
Unjabbed Brits could be BANNED from travelling to the EU next summer: Bloc's new proposals rule out entry unless you've been vaccinated within previous nine months in battle to contain Covid ,https://www.dailymail.co.uk/news/article-10242197/Unjabbed-Brits-BANNED-travelling-EU-summer.html
"Daily UK Covid cases flatline with 47,240 infections up just 0.9% on last week as deaths fall by another QUARTER and hospital admissions drop for ninth day in a row",https://www.dailymail.co.uk/news/article-10243433/Daily-UK-Covid-cases-flatline-47-240-infections-just-0-9-week.html
Waterloo is no longer Britain's busiest railway station after Covid pandemic causes commuter numbers to slump ,https://www.dailymail.co.uk/news/article-10244549/Waterloo-no-longer-Britains-busiest-railway-station-Covid-pandemic-causes-commuter-slump.html
"'Fit and healthy' mother-of-two, 51, died from blood clot 'likely' to have been caused by AstraZeneca Covid jab, inquest hears",https://www.dailymail.co.uk/news/article-10244507/Mum-two-51-died-blood-clot-likely-caused-AstraZeneca-Covid-jab.html
Canadian singer Bryan Adams tests positive for COVID after flying to Italy,https://www.dailymail.co.uk/news/article-10244009/Canadian-singer-Bryan-Adams-tests-positive-COVID-flying-Italy.html
"Cancer timebomb: 50,000 patients are feared to have missed out on diagnosis during Covid pandemic, study shows ",https://www.dailymail.co.uk/news/article-10244437/Cancer-timebomb-50-000-patients-feared-missed-diagnosis-Covid-pandemic.html
"How we turned Gaga into Gucci: As Lady Gaga turns her movie into a fashion show, the Oscar-winning British designer who created her dazzling outfits reveals how they made it work ",https://www.dailymail.co.uk/tvshowbiz/article-10244305/British-designer-reveals-turned-Lady-Gaga-Patrizia-Reggiani-new-Gucci-film.html
"Tory MP says young men turn to crime because 'Dr Who, Ghostbusters, Luke Skywalker are played or replaced by WOMEN and males are left with the Krays and Tommy Shelby' as he calls for masculinity to be 'celebrated rather than constantly vilified' ",https://www.dailymail.co.uk/news/article-10243333/Tory-MP-says-young-men-turn-crime-Dr-Luke-Skywalker-replaced-WOMEN.html
"From humble sandwich shop... to world's BIGGEST restaurant chain: Subway tycoon dies aged 90 after co-founding 'Pete's Super Submarines' in 1965 before becoming $1.7bn franchise king of 40,000 branches ",https://www.dailymail.co.uk/news/article-10243251/Subway-tycoon-Peter-Buck-dies-aged-90-founding-Petes-Super-Submarines-1965.html
Animal lovers blast HS2 builders for evicting badgers on the route of the £72bn rail project by using netting and one-way gates to get them out of their setts,https://www.dailymail.co.uk/news/article-10244531/Animal-lovers-blast-HS2-builders-evicting-badgers-route-72bn-rail-project.html
"Tolkien 'said no to Beatles musical': Fab Four were blocked from making Lord Of The Rings show by author, Peter Jackson claims ",https://www.dailymail.co.uk/news/article-10244475/The-Beatles-blocked-making-Lord-Rings-author-Peter-Jackson-claims.html
Backbench Tories head to Downing Street for face-off with Boris Johnson after 'a dozen MPs hand in letters of No Confidence in PM' - as Rishi Sunak is named 'politician of the year' in further sign of the Chancellor's political ascendancy,https://www.dailymail.co.uk/news/article-10242989/Spectator-names-Rishi-Sunak-parliamentarian-year-new-sign-Chancellors-political-rise.html
Blow for Sturgeon as poll finds 53% of Scots want to stay in the UK... after she DENIED support for independence is fading and renewed vow to call a referendum ,https://www.dailymail.co.uk/news/article-10243441/Blow-Sturgeon-poll-finds-53-Scots-want-stay-UK.html
"Would you buy a share in a classic car? If you want to invest but can't afford to buy one outright, some firms will offer you a stake - but you won't be allowed to drive it",https://www.dailymail.co.uk/money/cars/article-10221385/Should-invest-share-classic-car-Heres-works.html
