Headline,URL
"'The vaults of heaven will be ringing with rock': Iconic Bat Out of Hell singer Meat Loaf dies, aged 74, with his wife Deborah by his side - as stars pay tribute to flamboyant rocker who sold more than 100m albums",https://www.dailymail.co.uk/news/article-10426153/Bat-Hell-singer-Meat-Loaf-dies-74.html
Babes In The Wood killer Russell Bishop dies from brain cancer aged 55 - four years after being brought to justice for murdering two nine-year-old girls ,https://www.dailymail.co.uk/news/article-10426615/Babes-Wood-killer-Russell-Bishop-dies-brain-cancer-aged-55.html
Alan Carr announces he is separating from husband Paul Drayton after 13 years together as his ex battles alcoholism following drink-drive crash,https://www.dailymail.co.uk/tvshowbiz/article-10426581/Alan-Carr-announces-separating-husband-Paul-Drayton-three-years.html
"Prince Andrew's former maid tells how she 'was left in tears after ""demanding and entitled"" royal forced her to run up four flights of stairs to close his curtains despite him sitting right next to them' ",https://www.dailymail.co.uk/news/article-10424821/Prince-Andrews-former-maid-speaks-time-Buckingham-Palace.html
The seven rules for a 'proper' apology: Debrett's etiquette expert shares the phrases you should NEVER say including 'I'm sorry if I upset you' - and the ones you should use instead,https://www.dailymail.co.uk/femail/article-10423295/Etiquette-experts-Debrett-share-guide-proper-apologising.html
Rebel Tories 'threaten to expose secret recording' of 'blackmail' threats made by government whips as Kwasi Kwarteng dismisses claims MPs' constituencies were targeted saying he 'doesn't think this is happening' ,https://www.dailymail.co.uk/news/article-10426503/Rebel-Tories-threaten-expose-secret-recording-blackmail-threats-government-whips.html
"So are YOU entitled to a payout? As damning report says more than 100,000 pensioners were let down by the Government, how to find out if you have been short-changed ",https://www.dailymail.co.uk/news/article-10425327/How-short-changed.html
"Are scientists about to crack the secret of living to 130? Arthritis, dementia and diabetes reversed and 50 years of good health added to your lifespan could be on the horizon as likes of Jeff Bezos pour billions into anti-ageing research",https://www.dailymail.co.uk/femail/article-10425183/Dementia-diabetes-reversed-Jeff-Bezos-joins-tycoons-pouring-billions-new-research.html
"Party-loving British businesswoman mother-of-one, 31, suffers mysterious death in Jamaica as family say: 'She was perfectly healthy when she flew out'",https://www.dailymail.co.uk/news/article-10426451/Party-loving-British-businesswoman-mother-one-31-suffers-mysterious-death-Jamaica.html
"Three men are arrested for gross negligence manslaughter after pensioner, 73, was killed and two others were left needing hospital treatment when bridge collapsed during £900-a-head pheasant shoot ",https://www.dailymail.co.uk/news/article-10424343/Three-men-arrested-pensioner-73-killed-bridge-collapsed.html
"The rush hour resumes: Commuters pack onto Tube trains at 7am as big banks and city firms reveal plans to get workers back to their desks - but civil service unions dig in their heels and accuse PM of 'reckless, headlong' return ",https://www.dailymail.co.uk/news/article-10426077/Major-firms-reveal-plans-workers-desks.html
Tesco Extra security guard is guilty of murder after stabbing his ex-partner 21 times and grinning as he told police: 'I hope she is dead',https://www.dailymail.co.uk/news/article-10426391/Tesco-Extra-security-guard-guilty-murder.html
TOM UTLEY: How to beat the blues - award yourself £10 every time you hear the phrase 'mental health' on TV or radio ,https://www.dailymail.co.uk/debate/article-10425219/TOM-UTLEY-Award-10-time-hear-phrase-mental-health-TV-radio.html
The BIG FREEZE: Temperatures could plummet to -7C TODAY as Met Office predicts the coldest day of winter so far across England and Wales ,https://www.dailymail.co.uk/news/article-10426433/The-BIG-FREEZE-Temperatures-plummet-7C-TODAY.html
"Putin will be met with a 'united, swift and severe' response should he invade Ukraine, US Secretary of State Antony Blinken warns his Russian counterpart at talks in Geneva - as the world holds it breath",https://www.dailymail.co.uk/news/article-10426075/Ukraine-tensions-warns-Russia-consequences-troops-cross-border.html
Hundreds of combat ready British troops could be sent to Ukraine's Nato neighbours to bolster security forces amid threat of Russian invasion,https://www.dailymail.co.uk/news/article-10425307/Hundreds-combat-ready-British-troops-sent-Ukraines-Nato-neighbours.html
"Iran, China and Russia hold joint naval drills in Indian Ocean as Putin prepares to face off against the West in Ukraine ",https://www.dailymail.co.uk/news/article-10426219/Iran-China-Russia-hold-joint-naval-drills-Indian-Ocean-Putin-prepares-face-Ukraine.html
"Biden's dangerous, incoherent ramblings about the threat of war between Russia and Ukraine show that his mental decline may have disastrous consequences for America and the world, writes JIM GERAGHTY",https://www.dailymail.co.uk/news/article-10424393/Bidens-mental-decline-disastrous-consequences-world-writes-JIM-GERAGHTY.html
"Donald Trump launches attack on Biden's car-crash press conference and says he 'couldn't believe' he gave 'green light' to Putin's Ukraine ambitions and slams his Afghan withdrawal, border crisis and rampant inflation ",https://www.dailymail.co.uk/news/article-10425753/Trump-slams-Bidens-press-conference-says-believe-Russia-remarks.html
Retail sales plunged 3.7% in December as Omicron caused Christmas misery for high streets - with shops warning spiking inflation could hit trade even harder this year ,https://www.dailymail.co.uk/news/article-10426091/Retail-sales-plunged-3-7-December-Omicron-hit.html
Energy bills could rise AGAIN in the autumn after millions of households face 50 percent price hike in April as industry boss warns: 'We haven't seen anything like this in my career',https://www.dailymail.co.uk/news/article-10424525/Energy-bills-rise-autumn-millions-face-50-percent-price-hike-April.html
"British soldier is charged with tying up Italian couple at their home in Bali and forcing them to hand over password to £300,000 in Bitcoin",https://www.dailymail.co.uk/news/article-10426639/British-soldier-charged-tying-Italian-couple-home-Bali-stealing-300-000.html
"Driver at the wheel of an £80,000 BMW i8 supercar is caught speeding down the M5 at 142mph ",https://www.dailymail.co.uk/news/article-10426437/85-000-BMW-i8-hybrid-supercar-caught-speeding-142mph-M5-near-Somerset.html
"British doctor, 31, is killed by stray bullet while sleeping in his BED in Atlanta after someone in nearby apartment 'discharged their gun by mistake' ",https://www.dailymail.co.uk/news/article-10426481/British-doctor-31-killed-stray-bullet-Atlanta-lying-BED.html
"Gaspard Ulliel suffered such a severe blow to the head in fatal ski accident that he would likely still have died even if he had worn a helmet, investigators reveal",https://www.dailymail.co.uk/news/article-10426189/Helmet-not-stopped-Gaspard-Ulliel-fatal-head-injury-ski-accident-investigators-reveal.html
"Royal family will be 'relieved' if Duke and Duchess of Sussex don't come to Prince Philip's memorial because it will 'turn into the Harry and Meghan show', expert says",https://www.dailymail.co.uk/femail/article-10426497/Royal-family-relieved-Harry-Meghan-dont-come-Philips-memorial.html
"Multimillionaire wine tycoon, 50 - who owns vineyards behind Kumala and Journey's End wines - is locked in a bitter court fight with his businessman neighbour who sued him for not putting CURTAINS in his £3.2million Kensington flat ",https://www.dailymail.co.uk/news/article-10426319/Multimillionaire-wine-tycoon-50-locked-bitter-court-fight-neighbour-curtains.html
"Bright schoolboy, 15, who cares for his wheelchair-bound mother in their council flat after his father died in a hit-and-run wins £80,000 scholarship to Eton",https://www.dailymail.co.uk/news/article-10426565/Bright-schoolboy-15-wins-80-000-scholarship-Eton.html
"How could two sisters end up with two such different lives? One went to Oxford and enjoyed a high-powered career, the other's life ended in a tragedy her sibling is now struggling to come to terms with ",https://www.dailymail.co.uk/femail/article-10425065/How-two-sisters-end-two-different-lives-look-close-similar.html
"British synagogue terrorist was referred to PREVENT: More questions for security services as its revealed hostage taker, 44, was flagged to counterextremism scheme in 2016 after bitter split from wife",https://www.dailymail.co.uk/news/article-10426155/US-synagogue-terrorist-Malik-Faisal-Akram-Blackburn-referred-UKs-Prevent-programme.html
Belarus officials are charged with PIRACY for hijacking a Ryanair jet so they could arrest a dissident journalist,https://www.dailymail.co.uk/news/article-10426523/Belarus-officials-charged-PIRACY-Ryanair-flight-hijack.html
Alexa is back online after a two-hour outage that left users across Europe unable to access Amazon's smart assistant and other devices,https://www.dailymail.co.uk/sciencetech/article-10426325/Alexa-crashes-leaving-users-UK-unable-response-Echo-speakers.html
Should we be SHARING underwear to save the planet? Nicola McLean clashes with nurse who says ALL clothes can be recycled - but viewers say wearing used pants is 'taking sustainability too far',https://www.dailymail.co.uk/femail/article-10426579/Nicola-McLean-clashes-nurse-says-pants-recycled.html
No10 fears Partygate report 'will be worse than thought' for Boris: PM tears up his diary to woo mutinous MPs as Welsh First Minister accuses him of using Covid policy to distract attention,https://www.dailymail.co.uk/news/article-10426331/Fears-Partygate-report-worse-thought-Boris.html
Could Partygate help split the United Kingdom? Poll shows support for Scottish independence creeping up again to 50% as four-fifths say Boris should quit ,https://www.dailymail.co.uk/news/article-10426479/Poll-shows-Scots-independence-support-creeping-amid-Partygate.html
"Astonishment, disappointment, betrayal: ROBERT HARDMAN sees a sense of Bury South's outrage at turncoat MP, where locals predict it will all end in tears ",https://www.dailymail.co.uk/debate/article-10424937/ROBERT-HARDMAN-sees-sense-Bury-Souths-outrage-turncoat-MP.html
RICHARD LITTLEJOHN: Labour waved their little hands at Boris like Sooty and Sweep... but it's apparent that Boris Johnson isn't going anywhere (at least not this week) ,https://www.dailymail.co.uk/debate/article-10424653/RICHARD-LITTLEJOHN-Labour-waved-little-hands-Boris-like-Sooty-Sweep.html
What a welcome! Labour activists tell Tory defector Christian Wakeford they want a by-election - and THEY will decide if he can stand ,https://www.dailymail.co.uk/news/article-10424959/What-welcome-Labour-activists-tell-Tory-defector-Christian-Wakeford-want-election.html
"DAN WOOTTON: If Boris wants to survive he must put an end to green taxes, SAGE, Downing Street incompetents and Carrie's never-ending chaos ",https://www.dailymail.co.uk/debate/article-10424427/DAN-WOOTTON-Boris-wants-survive-end-green-taxes-SAGE.html
"It's enough to drive you to drink! Now a glass of wine a day is NOT good for your heart, experts say ",https://www.dailymail.co.uk/news/article-10425285/A-glass-wine-day-NOT-good-heart-experts-say.html
"A brisk walk instead of a casual stroll can cut a woman's heart failure risk by a THIRD, research suggests ",https://www.dailymail.co.uk/news/article-10425341/A-brisk-walk-instead-casual-stroll-cut-womans-heart-failure-risk-buy-THIRD.html
"Space debris from a Russian anti-satellite missile test came within 47 FEET of knocking out China's Tsinghua science satellite this week, Beijing claims",https://www.dailymail.co.uk/sciencetech/article-10426243/Russian-space-debris-came-47-feet-knocking-Chinese-satellite-Beijing-claims.html
KitKat bars with Hindu gods on the wrappers are withdrawn after sparking fury in India at the idea their deities would end up thrown in the trash,https://www.dailymail.co.uk/news/article-10426173/KitKat-bars-Hindu-gods-wrappers-withdrawn-sparking-fury-India.html
"Heartbreaking ordeal of grieving schoolboy comforted by Prince William: Deacon Glover, 11, lost his 'vivacious and caring' drug addict mother who lived a 'chaotic life' after she overdosed on heroin last year",https://www.dailymail.co.uk/femail/article-10426207/Heartbreaking-ordeal-boy-comfort-Prince-William.html
'He stared at her throughout the meal': Noel Gallagher claims Harvey Weinstein leered at his wife Sara MacDonald at bistro in Paris,https://www.dailymail.co.uk/tvshowbiz/article-10425213/Noel-Gallagher-claims-Harvey-Weinstein-leered-wife-Sara-MacDonald.html
"Horrible histories behind your favourite fairytales: New book reveals how dire poverty, war and being treated as outcasts inspired VERY dark tales by The Brothers Grimm and Hans Christian Andersen",https://www.dailymail.co.uk/femail/article-10414889/New-book-reveals-dark-origins-famous-fairy-tales.html
"Not guilty: Sailor on nearby ship who dozed through Titanic distress calls did NOT cost lives, says movie director James Cameron's favourite historian as he overturns history's damning 110-year-old verdict",https://www.dailymail.co.uk/news/article-10426389/SS-Californian-wireless-operator-did-NOT-cost-lives-sleeping-Titanic-distress-call.html
"Bionic eye implant lets blind woman see: Grandmother, 88, becomes first patient in country to benefit from ground-breaking treatment ",https://www.dailymail.co.uk/news/article-10425271/Bionic-eye-implant-lets-blind-woman-see.html
Is it the end of the line for annoying train announcements? Review could mean goodbye to loud messages on carriages ,https://www.dailymail.co.uk/news/article-10425073/Review-mean-goodbye-loud-messages-carriages.html
"Home is where the hell is! Photos revealing dodgy DIY, freak weather accidents and unwelcome house guests will make you glad you don't live in any of these properties ",https://www.dailymail.co.uk/femail/article-10423389/Homes-hell-wouldnt-want-live-places.html
Schools in open revolt over masks: More than 100 headteachers write to parents saying face coverings MUST stay as they blame staff shortages or Covid cases - but government CAN'T do anything to stop them ,https://www.dailymail.co.uk/news/article-10425957/Schools-open-revolt-masks.html
Businesses reveal raft of plans to get staff back to their desks from hybrid-working to 'fully open' offices after WFH was axed... while Civil Servants are accused of being reluctant to return to leave homes ,https://www.dailymail.co.uk/news/article-10424073/Businesses-reveal-plans-staff-desks-hybrid-working-fully-open-offices.html
"'Brain fog' caused by Covid could be a result of how the virus affects a person's spinal fluid, study finds",https://www.dailymail.co.uk/health/article-10424477/Brain-fog-caused-Covid-result-virus-affects-persons-spinal-fluid.html
"Wearing masks on planes DOES cut risk of Covid spreading, study confirms",https://www.dailymail.co.uk/news/article-10419559/Wearing-masks-planes-DOES-cut-risk-Covid-spreading-study-confirms.html
France will introduce new vaccine passport rules for visitors to cafes and restaurants from next week while Austria moves one step closer to making vaccines compulsory as Omicron cases surge on the continent ,https://www.dailymail.co.uk/news/article-10424289/France-week-introduce-new-vaccine-passport-rules-visitors-cafes-restaurants.html
Sage experts admit they got doom-laden forecast on Omicron wrong as Covid curbs are ditched ,https://www.dailymail.co.uk/news/article-10425197/Sage-experts-admit-got-doom-laden-forecast-Omicron-wrong-Covid-curbs-ditched.html
"Daily Covid cases fall just 1.6% in a week as Omicron curve shows signs of levelling off - as Sajid says flu can kill 20,000 people every winter but 'entire country does not shut down to deal with it'",https://www.dailymail.co.uk/news/article-10423549/Daily-Covid-cases-fall-just-1-6-week-Omicron-curve-begins-level-off.html
Banks lead the charge back to the office after working from home advice is axed,https://www.dailymail.co.uk/news/article-10425239/Banks-lead-charge-office-working-home-advice-axed.html
"Black-Caribbean Britons are ethnic group least likely to be triple-jabbed against Covid while just 40 per cent of Muslims have had their booster in England, latest figures show",https://www.dailymail.co.uk/news/article-10423513/Black-Caribbean-Britons-likely-triple-jabbed-against-Covid-latest-figures-show.html
China brings back anal swab testing for Covid two weeks before Winter Olympics begin,https://www.dailymail.co.uk/news/article-10426431/China-brings-anal-swab-testing-Covid-two-weeks-Winter-Olympics-begin.html
'Normal people don't go around destroying other human beings': Kieran Hayler's fiancee speaks out after he was accused of raping an underage girl while still married to Katie Price in 2016 - after model said she spoke to police,https://www.dailymail.co.uk/news/article-10426511/Kieran-Haylers-fiancee-Michelle-Penticost-speaks-Katie-Price-grooming-allegations.html
At least 17 people die and 500 houses are damaged when truck carrying explosives crashes into motorcycle in Ghana,https://www.dailymail.co.uk/news/article-10426559/At-17-people-die-500-houses-damaged-truck-crashes-motorcycle-Ghana.html
"Tommy Robinson is pursued for £2m by creditors after declaring himself bankrupt - as Syrian boy he wrongly accused of attacking girl is yet to receive a penny of £100,000 damages ",https://www.dailymail.co.uk/news/article-10426049/Tommy-Robinson-pursued-2m-creditors-declaring-bankrupt.html
"Tinder is charging young gay and lesbian users and over-30s up to 48% MORE for its premium Tinder Plus service than young straight users, investigation reveals",https://www.dailymail.co.uk/sciencetech/article-10423515/Tinder-charging-young-gay-lesbian-users-30s-48-more.html
Are YOU a true Yummy Mummy or a passé parent? Baby concierge reveals how status symbols such as a £300 Artipoppe baby carrier and Dior nappy bags are in for 2022 - but handprints and 'garish' baby gyms are OUT ,https://www.dailymail.co.uk/femail/article-10418831/How-300-Artipoppe-baby-carriers-ultimate-mumfluencer-status-symbols.html
Pamela Anderson files for DIVORCE from fifth husband Dan Hayhurst after just 13 months of marriage - and days after she was spotted in Malibu without wedding ring,https://www.dailymail.co.uk/news/article-10419249/Pamela-Anderson-files-divorce-husband-Dan-Hayhurst-just-year-marriage.html
"Why Pamela Anderson is seething over Lily James's 'disgusting' TV drama about her sex tape as the Baywatch legend's sixth marriage ends, writes ALISON BOSHOFF ",https://www.dailymail.co.uk/tvshowbiz/article-10424787/ALISON-BOSHOFF-Pamela-Anderson-seething-Lily-Jamess-disgusting-TV-drama.html
Peloton CEO DENIES it is stopping production of bikes and treadmills as shares plunge 27 percent after leaked company document said it had suffered 'significant reduction' in demand,https://www.dailymail.co.uk/news/article-10426333/Peloton-CEO-DENIES-stopping-production-bikes-treadmills-shares-plunge-27-percent.html
Hospital patients in Norfolk are moved into a HOTEL in a bid to free up beds in pilot scheme after local health service declared critical incident ,https://www.dailymail.co.uk/news/article-10426349/Hospital-Norfolk-moves-patients-HOTEL-bid-free-beds.html
"Italian care home resident, 91, dies while trying to escape by lowering himself out of a window with a bedsheet tied around his waist",https://www.dailymail.co.uk/news/article-10426467/Elderly-resident-dies-trying-escape-care-home-Italy.html
The International Space Station could soon have a FILM STUDIO and sports arena! UK firm reveals plans to attach a 'Space Entertainment Enterprise' to the ISS as early as 2024 ,https://www.dailymail.co.uk/sciencetech/article-10424095/The-International-Space-Station-soon-FILM-STUDIO.html
Advertising agency M&C Saatchi reveals the financial watchdog has dropped a probe into the company over £11.6million accounting scandal ,https://www.dailymail.co.uk/news/article-10426347/M-C-Saatchi-reveals-financial-watchdog-dropped-probe-company-scandal.html
"Man, 31, who struggled to find love despite 300 matches on dating apps reveals he's found a girlfriend after meeting the old-fashioned way in a bar - and says online matchmaking is 'making us shallow'",https://www.dailymail.co.uk/femail/article-10423373/Man-struggled-love-despite-having-300-matches-Tinder.html
Netflix loses nearly $45 billion in market cap after 'borderline catastrophic' forecast' showed almost 3.5M FEWER subscribers for 2022 first quarter ,https://www.dailymail.co.uk/news/article-10424547/Netflix-misses-subscriber-addition-estimates-shares-tumble-10.html
"Houses of Parliament are falling down: Chunks of masonry have fallen from crumbling 19th century buildings 15 times in last three years, figures show - including FOUR near-misses",https://www.dailymail.co.uk/news/article-10411867/Chunks-stonework-falling-crumbling-Parliament-ahead-planned-14billion-refurbishment.html
"'We are Christians... we've done nothing wrong': Church-going wife who banned gay couple from buying her £650,000 Surrey home due to their sexuality says she and her husband are just sticking to their beliefs",https://www.dailymail.co.uk/news/article-10424683/Wife-banned-gay-couple-buying-650-000-Surrey-home-says-sticking-beliefs.html
Caught on camera: Mystery man who rings couple's doorbell EVERY Thursday between 2am and 4am ,https://www.dailymail.co.uk/news/article-10426743/Mystery-man-rings-couples-doorbell-Thursday-2am-4am-Gloucestershire.html
How to get designer fashion for 80% less: Rise & Fall is the new way to buy luxury essentials without the luxury price tag of big brand names ,https://www.dailymail.co.uk/femail/article-10418913/Rise-Fall-new-way-buy-luxury-products-less.html
The Echo Dot has been reduced from £39.99 to just £21.99 thanks to this Amazon deal - so you can save 45% on the bestselling smart speaker,https://www.dailymail.co.uk/sciencetech/article-10422033/The-Echo-Dot-reduced-39-99-just-21-99-thanks-Amazon-deal.html
Downton star Michelle Dockery shows off her sparkler hours after announcing she is to marry Fleabag star Phoebe Waller-Bridge's brother - six years after losing her fiancé to cancer,https://www.dailymail.co.uk/tvshowbiz/article-10424695/Michelle-Dockery-marry-Jasper-Waller-Bridge-six-years-former-fiances-tragic-death.html
Novak Djokovic's coach breaks his silence on the tennis superstar's deportation from Australia - as he claims his treatment was 'unjust and unhealthy',https://www.dailymail.co.uk/news/article-10425911/Novak-Djokovics-coach-breaks-silence-tennis-superstars-deportation-Australia.html
Jailed cartel kingpin El Chapo faces BIGAMY claims as it's revealed he was still married to social worker first wife when he wed 'third' spouse Emma Coronel on her 18th birthday in 2007,https://www.dailymail.co.uk/news/article-10424523/Jailed-cartel-kingpin-El-Chapo-faces-BIGAMY-claims.html
"Electric car charging network grew 37% last year with 7,600 new devices installed - but North-South divide in availability grows",https://www.dailymail.co.uk/money/cars/article-10424161/Electric-car-charging-network-grows-37-North-South-divide-grows.html
E-scooters 'turn pavements into a jungle': Tory Baroness calls for urgent action over motorised devices and says they should be banned or face tough rules over use ,https://www.dailymail.co.uk/news/article-10425273/E-scooters-turn-pavements-jungle.html
"Sunflowers' invisible colours are revealed: UV bullseye pattern attracts pollinating insects and helps the plant regulate water loss, study reveals ",https://www.dailymail.co.uk/sciencetech/article-10423801/Sunflowers-invisible-colours-revealed.html
Butterkist Popcorn leaves bitter taste as marketers park giant billboard advert just feet away from the Cenotaph,https://www.dailymail.co.uk/news/article-10426571/Butterkist-Popcorn-leaves-bitter-taste-parking-billboard-just-feet-away-Cenotaph.html
BT announces price hike of more than 9% by end of March: Customers face paying extra £3.50-a-month for phone and broadband bills as cost of living crisis continues ,https://www.dailymail.co.uk/news/article-10424577/BT-announces-price-hike-9-end-March-cost-living-crisis-continues.html
"Daily dose of peanut powder may help up to THREE QUARTERS of children overcome their allergy, study claims",https://www.dailymail.co.uk/health/article-10421949/Children-peanut-allergies-slowly-increasing-exposure-study-suggests.html
"The best new motor for 2022 is electric: Kia's £41,000 EV6 trumps all petrol and diesel rivals to take What Car?'s Car of the Year award",https://www.dailymail.co.uk/money/cars/article-10421957/Kias-41-000-electric-EV6-Car-s-Car-Year-2022.html
"Obese women struggling to conceive are NOT more likely to get pregnant through fertility treatment if they lose weight, study suggests",https://www.dailymail.co.uk/health/article-10415551/Obese-women-struggling-conceive-NOT-likely-pregnant-lose-weight.html
"Rikki Neave was 'strangled with his own anorak' and a zip-shaped mark was left on schoolboy's neck, court hears as jurors are shown chilling images of six-year-old clothes that were found in a wheelie bin ",https://www.dailymail.co.uk/news/article-10422613/Accused-killer-40-schoolboy-Rikki-Neave-revealed-wealth-new-court-hears.html
Backlash over bid to 'cover up' daily migrant figures: MPs and campaigners blast Priti Patel over 'cowardly act' saying she is more concerned about 'burying bad news than being transparent' as Channel crisis worsens ,https://www.dailymail.co.uk/news/article-10424681/Backlash-bid-cover-daily-migrant-figures-Priti-Patel-blasted-cowardly-act.html
