Headline,URL
The £30m bill to help the civil service work from home: That was the cost of Covid lockdown move after government departments paid millions on IT equipment and office furniture including FOOTRESTS,https://www.dailymail.co.uk/news/article-10294359/Work-home-civil-service-aided-30million-taxpayers-money.html
"'I need this for my tree!': McDonald's fans go wild as chain announces it will give away more than 3,000 Big Mac BAUBLES for 2021",https://www.dailymail.co.uk/femail/food/article-10292335/McDonalds-fans-wild-restaurant-announces-away-3-000-Big-Mac-BAUBLES.html
'Travis Scott is not a victim': Grieving family of young man killed in Astroworld tragedy slams rapper for refusing to take responsibility in crowd disaster and blaming his 'in-ear' person for not stopping the show,https://www.dailymail.co.uk/news/article-10292975/Travis-Scott-does-NOT-responsibility-AstroWorld-tragedy.html
London-based billionaire Robert Tchenguiz accuses ex-wife of 'fabrication and lies' over her claims in Montana court that he plans to 'force their 14-year-old son to have sex with a prostitute' ,https://www.dailymail.co.uk/news/article-10292663/Billionaire-Robert-Tchenguiz-accuses-ex-wife-fabrication-lies.html
"Alec Baldwin posts letter from Rust crew to Instagram that denies set was 'chaotic dangerous and exploitative,' though admits that some members quit but they do 'not represent the views of all of us'",https://www.dailymail.co.uk/news/article-10293745/Alex-Baldwin-shares-Rust-crew-letter-denying-set-chaotic-dangerous-exploitative.html
Did the CIA spy on James Brown? Intelligence service refuses to confirm long-running rumours it monitored the soul legend ,https://www.dailymail.co.uk/news/article-10294875/CIA-refuses-confirm-long-running-rumours-monitored-James-Brown.html
"Ayyee! Henry Winkler's Happy Days memorabilia sells for a cool $320,000: Fonzie's iconic leather jacket sells at auction for $75,000 while his Triumph motorbike goes for $230,000",https://www.dailymail.co.uk/tvshowbiz/article-10294815/Ayyee-Henry-Winklers-Happy-Days-memorabilia-sells-320K.html
"Inside the UK's first net zero McDonald's: Shropshire branch has a Drive-Thru lane made from recycled tyres, cladding constructed from old IT equipment and vegan McPlant burgers - and will provide a blueprint for future restaurants ",https://www.dailymail.co.uk/sciencetech/article-10293217/Inside-UKs-net-zero-emissions-McDonalds.html
Britain will get fastest trains in Europe with top speed of 225mph for new HS2 line in £2billion deal with manufacturers Hitachi and Alstom,https://www.dailymail.co.uk/news/article-10293407/HS2-deal-sees-Britain-fastest-trains-Europe-speed-225mph.html
TOM UTLEY: Elon Musk is right - it's NOT selfish to have lots of children. Who else will pull pints in the future? ,https://www.dailymail.co.uk/debate/article-10294799/TOM-UTLEY-Elon-Musk-right-NOT-selfish-lots-children.html
Is this the key to preventing vision issues in space? High-tech SLEEPING BAG is developed that pulls down body fluids that naturally flow into astronauts' heads while they sleep,https://www.dailymail.co.uk/sciencetech/article-10292469/Space-High-tech-SLEEPING-BAG-developed-help-prevent-vision-issues-astronauts.html
Glamorous Australian lollipop lady reveals she got paid more than $5k for four days of work - and why she will still quit the job to pursue a new career,https://www.dailymail.co.uk/news/article-10294485/Glamorous-Australian-lollipop-lady-reveals-shes-paid-5k-WEEK.html
Video games at the wheel: New Tesla tech lets owners play while they drive... but safety campaigners say could be a dangerous distraction even if a passenger is using it ,https://www.dailymail.co.uk/news/article-10294591/Video-games-wheel-New-Tesla-tech-lets-owners-play-drive.html
"Bigler 'Bud' Stouffer, 79, becomes oldest inmate to be executed in US history: Murderer is given final meal of chicken and broccoli before being put to death by lethal injection for killing teacher ex-girlfriend in 1985",https://www.dailymail.co.uk/news/article-10293549/Oklahoma-executes-Bigle-Stouffer-murder-teacher-attempted-murder-boyfriend.html
"From taking potions to become a virgin again to priests casting love spells to charm women into bed, the VERY raunchy history of sex in the Middle Ages is revealed in a new book",https://www.dailymail.co.uk/femail/article-10268783/The-raunchy-history-sex-Middle-Ages-revealed-new-book.html
"DNA evidence reveals woolly mammoths roamed Canada until just 5,000 years ago: Soil samples from under the permafrost in the Yukon territory debunk theory beasts died out in North America in 7,000 BC ",https://www.dailymail.co.uk/sciencetech/article-10293777/DNA-evidence-frozen-permafrost-reveals-woolly-mammoths-roamed-Canada-5-000-years-ago.html
Why there's nothing so captivating as a cape: Sensual rather than sexy - and they cover up your arms... ALEXANDRA SHULMAN pays tribute to a quirky fashion item ,https://www.dailymail.co.uk/femail/article-10294823/ALEXANDRA-SHULMAN-theres-captivating-cape.html
James Bond bosses 'clashing with Amazon bigwigs over plans to turn 007 into Marvel-style franchise',https://www.dailymail.co.uk/tvshowbiz/article-10294709/James-Bond-bosses-clashing-Amazon-bigwigs-plans-turn-007-Marvel-style-franchise.html
"Biden administration is 'clearly not' asking Ukraine to cede territory to Putin after 'warm' phone call with Zelensky, administration officials say",https://www.dailymail.co.uk/news/article-10293107/Biden-speaks-Ukrainian-President-Zelensky.html
E-scooters are BANNED on London public transport after one EXPLODED on packed Tube - as data reveals city's fire fighters attended over 50 blazes involving electric gadgets this year,https://www.dailymail.co.uk/news/article-10292397/E-scooters-BANNED-London-public-transport-one-EXPLODED-packed-Tube.html
Liz Truss vows free speech will be protected in conversion therapy ban as she extends public consultation period ahead of law change,https://www.dailymail.co.uk/news/article-10293429/Liz-Truss-vows-free-speech-protected-conversion-therapy-ban.html
"Moment of truth for LV: If the vote goes against them, insurer's top brass have only themselves to blame, says RUTH SUNDERLAND",https://www.dailymail.co.uk/money/comment/article-10293749/RUTH-SUNDERLAND-Moment-truth-LV-private-equity-buyout-fight.html
Legal action could derail LV's £530m private equity takeover even if bosses win vote ,https://www.dailymail.co.uk/money/markets/article-10293881/Legal-action-derail-LVs-530m-private-equity-takeover.html
Keep calm and make vaccines... Our critic selects his picks of this year's best science books ,https://www.dailymail.co.uk/home/books/article-10293925/Our-critic-selects-picks-years-best-science-books.html
Made gets a mauling as shares drop again: Online furniture seller reveals it is suffering severe stock issues,https://www.dailymail.co.uk/money/markets/article-10294117/Online-furniture-seller-gets-mauling-shares-drop-again.html
"Top doctor warns parents against circumcising their children after a toddler, 2, died 'of a reaction to anaesthetic' and his baby brother almost bled out ",https://www.dailymail.co.uk/news/article-10293843/Circumcision-warning-two-year-old-dies-brother-bleeds-Western-Australia.html
"Perfect timing for Christmas, says Watches of Switzerland as sales of luxury timepieces soar ",https://www.dailymail.co.uk/money/markets/article-10294005/Perfect-timing-Christmas-says-Watches-Switzerland.html
A Christmas present like you've never seen one before: How to wrap a gift to look like a tiny T-SHIRT - complete with a little bow tie ,https://www.dailymail.co.uk/femail/article-10294785/How-wrap-gift-look-like-tiny-T-SHIRT-complete-little-bow-tie.html
"Presents that really are picture perfect: From Marilyn in her birthday suit to the bad boy of ballet, 2021's best illustrated books ",https://www.dailymail.co.uk/home/books/article-10293915/From-Marilyn-birthday-suit-bad-boy-ballet-2021s-best-illustrated-books.html
'Zombie fires' burn near the world's coldest village despite temperatures of MINUS 60C: Blazes are blamed on underground gases released by climate change ,https://www.dailymail.co.uk/news/article-10292759/Zombie-fires-burn-near-worlds-coldest-village-despite-temperatures-MINUS-60C.html
"From Hockney to Kahlo, here's a festive feast for the eyes: Our critic selects her picks of this year's best art books",https://www.dailymail.co.uk/home/books/article-10294101/Our-critic-selects-picks-years-best-art-books.html
