Headline,URL
I talked to Sergei Lavrov — here’s what he said,https://www.independent.co.uk/voices/sergei-lavrov-putin-russia-ukraine-b2027701.html
Should the west start preparing for the post-Putin era?,https://www.independent.co.uk/independentpremium/voices/putin-russia-ukraine-war-sanctions-b2027924.html
Why don’t we sanction more oligarchs? Let the Tories explain,https://www.independent.co.uk/voices/russian-oligarchs-uk-non-dom-sanctions-ukraine-b2027818.html
‘Nuclear terror’: Zelensky tells world to ‘wake up’ after attack on atomic plant,https://www.independent.co.uk/news/world/europe/ukraine-russia-latest-putin-war-nuclear-b2028400.html
Russian pundit toasts ‘death of the stockmarket’ to stunned TV host,https://www.independent.co.uk/news/world/europe/russia-stock-market-moscow-exchange-b2028216.html
Distraught father sobs over body of son killed in Russian shelling,https://www.independent.co.uk/news/world/europe/russia-ukraine-war-mariupol-child-death-b2028459.html
‘Worst is yet to come’ as Putin vows to bomb Ukraine ‘until the end’,https://www.independent.co.uk/news/world/europe/putin-macron-worst-to-come-zelensky-talks-b2028151.html
"Ikea stands down 15,000 workers in Russia and Belarus",https://www.independent.co.uk/life-style/ikea-suspends-activities-russia-belarus-ukraine-b2027770.html
Refugees Welcome: Government pledges to match donations for our Ukraine appeal,https://www.independent.co.uk/news/world/europe/refugees-welcome-ukraine-appeal-donations-b2027473.html
"Putin risks imprisonment for war crimes, Raab says as Johnson seeks emergency UN meeting",https://www.independent.co.uk/news/uk/politics/boris-johnson-news-latest-sanctions-russia-putin-b2028333.html
Labour wins Birmingham Erdington by-election,https://www.independent.co.uk/news/uk/politics/labour-birmingham-erdington-byelection-hamilton-b2028306.html
‘It’s hard to know what’s true’: Foreigners face fake news in Russia,https://www.independent.co.uk/news/world/europe/russia-ukraine-war-moscow-media-b2027940.html
Ukraine’s first lady pays tribute to ‘incredible’ women facing war,https://www.independent.co.uk/life-style/women/ukrainian-first-lady-olena-zelenska-tribute-b2028485.html
BBC guest demands to be paid during interview on Ukraine,https://www.independent.co.uk/tv/news/russia-ukraine-bbc-interview-guest-b2027873.html
Ukrainians jeer Russian soldier demanding their surrender while holding grenades,https://www.independent.co.uk/tv/news/russia-ukraine-soldier-grenades-surrender-b2027832.html
‘We’ll live without your pretty things!’ Father smashes son’s iPad after Apple halts sales in Russia,https://www.independent.co.uk/tv/news/apple-ipad-russia-invasion-ukraine-b2027735.html
Indian TV host erupts at guest in case of mistaken identity,https://www.independent.co.uk/tv/news/indian-tv-host-shouts-at-wrong-guest-during-ukraine-segment-b2027817.html
Brexiteer Tory says new forms for trading with EU are ‘monstrous’,https://www.independent.co.uk/news/uk/politics/brexit-bureacracy-tory-mp-desmond-swayne-b2027780.html
How The Osbournes changed reality TV forever,https://www.independent.co.uk/arts-entertainment/tv/features/the-osbournes-show-sharon-kelly-b2028417.html
Renegade rocket hurtles towards far side of the moon,https://www.independent.co.uk/space/space-rocket-moon-crash-today-b2028461.html
Snow and gales to batter Britain as temperatures set to plunge,https://www.independent.co.uk/news/uk/home-news/uk-weather-snow-forecast-today-b2027627.html
Captain Tom Foundation flagged to watchdogs by NHS charities,https://www.independent.co.uk/news/uk/home-news/captain-tom-foundaiton-nhs-charities-together-b2023545.html
How you can find a rewarding Civil Service career,https://www.independent.co.uk/news/civil-service-career-jobs-advice-b2018864.html
Every generation must renew the struggle against racism and fascism,https://www.independent.co.uk/voices/editorials/ukraine-racism-border-russia-conflict-b2027866.html
Why India abstained at UN over Russia invasion of Ukraine,https://www.independent.co.uk/independentpremium/politics-explained/india-un-russia-ukraine-b2028199.html
Why Colin Farrell’s run of flops was the best thing to ever happen to him,https://www.independent.co.uk/independentpremium/culture/colin-farrell-penguin-batman-b2026858.html
‘Proud Ukrainian’ Mila Kunis vows to match donations of $3m,https://www.independent.co.uk/arts-entertainment/films/news/ukraine-russia-mila-kunis-ashton-kutcher-b2028418.html
Government ‘did not sufficiently consider’ tree-planting aims,https://www.independent.co.uk/climate-change/news/tree-planting-targets-defra-nao-b2027964.html
Dozens killed in Pakistan mosque explosion,https://www.independent.co.uk/asia/south-asia/peshawar-explosion-mosque-deaths-pakistan-b2028466.html
Kim Kardashian deletes ‘West’ from social media,https://www.independent.co.uk/life-style/love-sex/kim-kardashian-west-instagram-kanye-b2028457.html
Couple lose privacy case in mannequin row with neighbour ,https://www.independent.co.uk/news/uk/home-news/high-court-privacy-richmond-park-b2027703.html
"12 actors who slagged off films, from Sam Elliott to Orson Welles",https://www.independent.co.uk/arts-entertainment/films/features/actors-who-hated-other-films-b2028444.html
Mira Sorvino says her early career is ‘tainted’ by Woody Allen,https://www.independent.co.uk/arts-entertainment/films/news/mira-sorvino-woody-allen-marc-maron-b2028119.html
How to watch every event live from Beijing,https://www.independent.co.uk/sport/olympics/paralympics/winter-paralympics-2022-tv-uk-b2028454.html
Russian team won’t appeal Winter Paralympics ban,https://www.independent.co.uk/sport/russia-winter-paralympics-ban-beijing-ukraine-b2028500.html
Formula 1 terminates contract with Russian Grand Prix,https://www.independent.co.uk/sport/motor-racing/formula1/russian-grand-prix-f1-contract-b2027606.html
"It’s time to find out if Manchester United are good, bad or broken",https://www.independent.co.uk/sport/football/manchester-united-news-fixtures-city-b2028449.html
Djokovic set to play at French Open as France scraps vaccine passes,https://www.independent.co.uk/sport/tennis/novak-djokovic-french-open-covid-visa-b2027711.html
Sign up to The Independent’s free Sports Brief newsletter ,https://www.independent.co.uk/sport/the-independent-free-sport-newsletter-b1892215.html
Clyde to cancel Goodwillie loan deal with Raith Rovers after backlash ,https://www.independent.co.uk/sport/football/david-goodwillie-clyde-raith-rovers-b2028244.html
Golden eagle numbers in southern Scotland soar,https://www.independent.co.uk/climate-change/news/golden-eagles-scotland-world-wildlife-day-b2027044.html
Turtles suffering hearing loss due to underwater noise pollution,https://www.independent.co.uk/news/science/turtles-hearing-loss-noise-pollution-b2027499.html
UN approves ‘most significant’ green deal since Paris accord,https://www.independent.co.uk/climate-change/news/plastic-pollution-global-treaty-unea-b2026781.html
"Billions to suffer impact of climate crisis, major UN report warns",https://www.independent.co.uk/climate-change/news/ipcc-climate-report-global-warming-floods-b2024490.html
"Climate impacts on biodiversity threaten food supplies, IPCC warns",https://www.independent.co.uk/climate-change/news/ipcc-biodiversity-food-shortages-extinctions-b2025086.html
Australia at climate ‘precipice’ amid major flooding in eastern areas,https://www.independent.co.uk/climate-change/news/australia-flooding-ipcc-extreme-weather-b2025790.html
Threats to peace are reduced by climate action — even Ukraine sees it,https://www.independent.co.uk/climate-change/news/ipcc-russia-ukraine-oil-renewables-b2024531.html
The story of rice: how a humble grain changed the world,https://www.independent.co.uk/independentpremium/long-reads/how-rice-changed-the-world-b2021187.html
Could British mercenaries get involved in Ukraine war?,https://www.independent.co.uk/independentpremium/politics-explained/mercenaries-ukraine-war-politics-explained-b2026098.html
How can the government prevent a ‘two-tier’ system over NHS care?,https://www.independent.co.uk/independentpremium/news-analysis/nhs-care-boris-johnson-funding-covid-b2026038.html
How our personal money links us to the rest of the world,https://www.independent.co.uk/independentpremium/business/ukraine-fuel-energy-prices-increase-food-import-trade-b2025521.html
Wanted: the adaptable Rishi Sunak seen during the Covid-19 pandemic,https://www.independent.co.uk/independentpremium/business/tax-national-insurance-sunak-boris-johnson-b2026006.html
"The PM wanted to be Churchill, but this is the wrong kind of war",https://www.independent.co.uk/independentpremium/voices/boris-johnson-ukraine-war-churchill-b2025877.html
Peter Singer: The most controversial philosopher alive today,https://www.independent.co.uk/independentpremium/peter-singer-philosopher-controversial-alive-b2025595.html
Explosion seen near Zaporizhzhya nuclear power plant in Ukraine,https://www.independent.co.uk/tv/news/explosion-zaporizhzhya-nuclear-power-plant-ukraine-v61cb1b4d
Ukraine: Missiles hit country’s biggest nuclear power plant causing major fires,https://www.independent.co.uk/tv/news/russia-ukraine-nuclear-plant-zaporizhzhia-v60e4216b
Ukrainian couple get married in Odesa bomb shelter as war rages outside,https://www.independent.co.uk/tv/news/ukraine-russia-bomb-shelter-marriage-v7f0a1b74
Watch live as soldiers patrol Kyiv after Russia seizes Zaporizhzhia nuclear plant,https://www.independent.co.uk/tv/news/watch-live-as-soldiers-patrol-kyiv-after-russia-seizes-zaporizhzhia-nuclear-plant-v04c6285d
"The Godfather at 50: Chaos, Coppola and the making of a classic",https://www.independent.co.uk/arts-entertainment/films/features/the-godfather-coppola-anniversary-b2025549.html
Postwar Modern review: a genuinely polemical exhibition,https://www.independent.co.uk/independentpremium/culture/postwar-modern-review-barbican-b2026690.html
Lucy and Desi is an antidote to the failures of Being the Ricardos,https://www.independent.co.uk/arts-entertainment/tv/reviews/lucy-and-desi-review-lucille-ball-b2027502.html
Tom Hanks to explain why he fired ‘dead-eyed’ Band of Brothers actor ,https://www.independent.co.uk/arts-entertainment/tv/news/tom-hanks-band-of-brothers-dead-eyes-b2028515.html
The Batman producer gave Christopher Nolan a Dark Knight warning ,https://www.independent.co.uk/arts-entertainment/films/news/the-batman-movie-dark-knight-b2028533.html
Dominic Fike releases ‘Elliot’s Song’ from Euphoria season 2 finale,https://www.independent.co.uk/arts-entertainment/music/news/dominic-fike-elliots-song-lyrics-zendaya-b2028475.html
The Power of the Dog’s Jane Campion banned phones on set,https://www.independent.co.uk/arts-entertainment/films/news/power-of-the-dog-jane-campion-b2028460.html
Glastonbury releases first lineup poster for this year’s festival,https://www.independent.co.uk/arts-entertainment/music/news/glastonbury-2022-lineup-kendrick-lamar-tickets-b2028448.html
Mila Kunis and Ashton Kutcher vow to match Ukraine donations of $3m,https://www.independent.co.uk/arts-entertainment/films/news/ukraine-russia-mila-kunis-ashton-kutcher-b2028418.html
Roman Abramovich bought a football club and changed the sport forever,https://www.independent.co.uk/sport/football/chelsea-roman-abramovich-sale-legacy-b2027658.html
Drive to Survive still way ahead of the pack to leave F1 fans gripped,https://www.independent.co.uk/sport/motor-racing/formula1/drive-to-survive-review-season-4-b2026875.html
Marsch faces tactical challenge and cultural shock at Leeds United,https://www.independent.co.uk/sport/football/jesse-marsch-leeds-united-manager-b2026044.html
Winter Paralympics begin in shadow of war and without Russian athletes,https://www.independent.co.uk/sport/winter-olympics/winter-paralympics-opening-ceremony-ukraine-b2028408.html
Former Australia wicketkeeper and England selector Marsh dies aged 74,https://www.independent.co.uk/sport/cricket/western-australia-paul-england-cricket-australia-marylebone-cricket-club-b2028303.html
"Premier League TV rights deal in Russia under review, Masters reveals",https://www.independent.co.uk/sport/football/premier-league-russia-richard-masters-gazprom-roman-abramovich-b2027759.html
"Best mattress 2022: Memory foam, pocket sprung and hybrids reviewed",https://www.independent.co.uk/extras/indybest/house-garden/mattresses/best-mattress-a6950396.html
8 best cordless vacuum cleaners for hassle-free hoovering,https://www.independent.co.uk/extras/indybest/house-garden/vacuum-cleaners/best-cordless-vacuum-cleaners-reviews-uk-under-100-for-pet-hair-stairs-hard-floors-dyson-a9617861.html
9 best electric toothbrushes that keep teeth healthy and bright,https://www.independent.co.uk/extras/indybest/gadgets-tech/best-electric-toothbrushes-a9679161.html
10 best pillows that provide comfort and support,https://www.independent.co.uk/extras/indybest/house-garden/bedroom/best-pillows-firm-neck-support-shoulder-pain-back-sleepers-side-memory-foam-cooling-a9678086.html
16 best Bluetooth speakers for every budget,https://www.independent.co.uk/extras/indybest/gadgets-tech/audio/best-bluetooth-speaker-portable-uk-b1775584.html
Best VPN services in the UK for streaming and security in 2022,https://www.independent.co.uk/extras/indybest/gadgets-tech/best-vpn-free-paid-iphone-android-streaming-netflix-mac-windows-torrenting-b1811919.html
Everything you need to know about Glossybox,https://www.independent.co.uk/extras/lifestyle/glossybox-beauty-subscription-box-price-b2007210.html
Australia floods: Residents and horses trapped overnight on bridge in New South Wales,https://www.independent.co.uk/tv/climate/australia-floods-weather-horses-trapped-vc708273c
River Severn floods fields in Apperley after UK lashed by storms,https://www.independent.co.uk/tv/climate/uk-weather-flooding-river-severn-v602d214c
Watch live as UN releases report on impact of climate crisis,https://www.independent.co.uk/tv/climate/un-release-report-climate-crisis-vadc31f38
Cornwall: Ocean spume swamps Lizard peninsula after recent storms,https://www.independent.co.uk/tv/climate/cornwall-storm-eunice-franklin-spume-vb72c18f8
"Enjoy a ‘blue voyage’, sailing around Türkiye’s beautiful Aegean coast",https://www.independent.co.uk/travel-0/travel-aegean-aegean-sea-turkiye-turkey-holiday-yachting-blue-voyage-coast-sailing-b2000916.html
Discover Dalaman: Relax and revitalise in Türkiye’s natural paradise ,https://www.independent.co.uk/travel-0/dalaman-spas-turkiye-turkey-aegean-sustainable-travel-nature-turtles-b2001015.html
10 thoughtful Mother’s Day gifts for every type of mum ,https://www.independent.co.uk/extras/lifestyle/mothers-day-gift-guide-2022-b2024738.html
Enjoy a sensory adventure in Türkiye’s spectacular Bodrum,https://www.independent.co.uk/travel-0/bodrum-luxury-turkiye-turkey-travel-aegean-spas-retreats-b2001259.html
‘You’re being emotional’: What happened when I talked to Sergei Lavrov,https://www.independent.co.uk/voices/sergei-lavrov-putin-russia-ukraine-b2027701.html
"Please welcome Nadine Dorries, the BBC’s new best friend",https://www.independent.co.uk/independentpremium/voices/nadine-dorries-bbc-ukraine-russia-b2027792.html
Does the west need to start preparing for the post-Putin era?,https://www.independent.co.uk/independentpremium/voices/putin-russia-ukraine-war-sanctions-b2027924.html
The Independent daily cartoon,https://www.independent.co.uk/news/the-independent-daily-cartoon-a8575981.html
Why is the UK not sanctioning more oligarchs? Let the Tories explain,https://www.independent.co.uk/voices/russian-oligarchs-uk-non-dom-sanctions-ukraine-b2027818.html
Stigmatising Russian people and culture plays right into Putin’s hands,https://www.independent.co.uk/voices/russsia-sanctions-putin-ukraine-b2027687.html
What we can learn about Zelensky from his Servant of the People sitcom,https://www.independent.co.uk/voices/volodymyr-zelensky-servant-of-the-people-b2027650.html
My family tree is filled with refugees – I support Refugees Welcome,https://www.independent.co.uk/voices/refugees-welcome-ukraine-war-jews-b2027563.html
"A year on from Sarah Everard, I’m still afraid to walk home at night",https://www.independent.co.uk/voices/sarah-everard-violence-against-women-b2027514.html
Our children will forever think of Russia as a pariah state,https://www.independent.co.uk/voices/russia-soviet-union-representation-in-culture-b2027675.html
Love Is Blind: Is it possible to fall in love in just 10 days?,https://www.independent.co.uk/life-style/love-sex/love-is-blind-fall-in-love-10-days-b2022502.html
How to support the people of Ukraine as Russia declares war,https://www.independent.co.uk/life-style/ukraine-war-how-to-help-donate-b2022207.html
The complicated legacy of Geri Halliwell’s Union Jack dress,https://www.independent.co.uk/life-style/fashion/geri-halliwell-union-jack-fashion-b2022499.html
LFW designers champion sensuality in the eye of the storm,https://www.independent.co.uk/life-style/fashion/london-fashion-week-reviews-bora-aksu-rixo-nensi-dojaka-b2018213.html
Kanye West’s behaviour isn’t funny – it’s abusive,https://www.independent.co.uk/life-style/love-sex/kanye-west-kim-kardashian-red-flags-abuse-b2018382.html
Andrew has hurt the Queen’s legacy - and put the monarchy in danger,https://www.independent.co.uk/life-style/royal-family/prince-andrew-settlement-omid-scobie-b2016659.html
Why do we treat victims of romance scams so poorly?,https://www.independent.co.uk/life-style/love-sex/tinder-swindler-inventing-anna-scam-victims-b2013139.html
From Wordle to Pete Davidson: The dos and don’t of love,https://www.independent.co.uk/life-style/love-sex/valentines-day-romance-love-pop-culture-b2014874.html
‘I staged a protest against the Pretty Little Thing fashion show’,https://www.independent.co.uk/life-style/fashion/pretty-little-thing-protest-molly-mae-hague-b2017557.html
The world reacts as Russia seizes Ukraine's biggest nuclear plant,https://www.independent.co.ukhttps://www.indy100.com/news/ukraine-zaporizhzhia-nuclear-power-plant-reactions
All the Russian oligarchs sanctioned by the UK so far,https://www.independent.co.ukhttps://www.indy100.com/news/russian-oligarchs-sanctioned-uk-government
What is today's Wordle answer #222?,https://www.independent.co.ukhttps://www.indy100.com/viral/what-todays-wordle-answer-222
What is today's Wordle answer #220?,https://www.independent.co.ukhttps://www.indy100.com/viral/what-todays-wordle-answer-220
What is today's Wordle answer #221?,https://www.independent.co.ukhttps://www.indy100.com/viral/what-todays-wordle-answer-221
What is today's Wordle 218 answer?,https://www.independent.co.ukhttps://www.indy100.com/viral/wordle-218-answer-game-today
What is the Wordle answer 213?,https://www.independent.co.ukhttps://www.indy100.com/viral/wordle-answer-213-today-b1995097
We tried The Body Shop’s new 40-shade range foundation,https://www.independent.co.uk/extras/indybest/fashion-beauty/make-up/body-shop-fresh-nude-foundation-review-b1996051.html
‘Pokémon Legends: Arceus’ details leak ahead of release day,https://www.independent.co.uk/extras/indybest/gadgets-tech/video-games-consoles/pokemon-legends-arceus-leak-details-b1997035.html
Aldi’s £69.99 outdoor log burner is back: Here’s how to buy it,https://www.independent.co.uk/extras/indybest/house-garden/garden-furniture/aldi-log-burner-outdoor-garden-b1997773.html
When does the Boots 70% off sale start?,https://www.independent.co.uk/extras/indybest/fashion-beauty/beauty/when-is-boots-70-off-sale-2022-b1994502.html
7 best robot vacuum cleaners 2022: Let it do the hard work for you,https://www.independent.co.uk/extras/indybest/house-garden/vacuum-cleaners/best-robot-vacuum-cleaners-a9451721.html
10 great education and schooling ideas,https://www.independent.co.uk/life-style/10-great-education-and-schooling-ideas-b2001341.html
PS5 restock UK: Where to buy or pre-order Sony’s PlayStation 5 today ,https://www.independent.co.uk/extras/indybest/gadgets-tech/video-games-consoles/ps5-restock-pre-order-uk-where-b1874579.html
12 best mattress toppers that make you feel like you’re on cloud nine,https://www.independent.co.uk/extras/indybest/house-garden/bedroom/best-mattress-toppers-a6999421.html
8 best IPL and laser hair-removal machines to use at home,https://www.independent.co.uk/extras/indybest/fashion-beauty/hair/best-home-laser-ipl-hair-removal-machines-a9417941.html
Western Digital My Passport SSD is the storage device of your dreams ,https://www.independent.co.uk/extras/lifestyle/western-digital-my-passport-ssd-b2008782.html
20% or more off electricals in the Very sale,https://www.independent.co.ukhttps://www.independent.co.uk/vouchercodes/very
£30 off £300+ orders with this MADE discount code,https://www.independent.co.ukhttps://www.independent.co.uk/vouchercodes/made
£5 off your first order - Oliver Bonas promo,https://www.independent.co.ukhttps://www.independent.co.uk/vouchercodes/oliver-bonas
Gousto discount code: 1st box 65% off + 30% off in month 1,https://www.independent.co.ukhttps://www.independent.co.uk/vouchercodes/gousto
£50 off PerfectDraft Machine Bundles - Beer Hawk discount code,https://www.independent.co.ukhttps://www.independent.co.uk/vouchercodes/beer-hawk
15% off any order using this Sweaty Betty discount code,https://www.independent.co.ukhttps://www.independent.co.uk/vouchercodes/sweaty-betty
£15 gift card with annual memberships using Direct Debit at National Trust,https://www.independent.co.ukhttps://www.independent.co.uk/vouchercodes/national-trust
